_id,location_id,location,lng,lat,centreline_type,centreline_id,px,latest_count_date
2905,12374,RAYMORE DR AT SCARLETT RD,-79.5205890787427,43.6958200224051,2,13459195,,2013-01-23
2906,12382,MIDLAND AVE AT SALOME DR & WEYBRIGHT CRT,-79.2768388353461,43.7823019180608,2,13445567,,2002-02-26
2907,12383,EMBLEM CRT AT MIDLAND AVE,-79.2754560120198,43.7789147944014,2,13445987,2297,2012-02-07
2908,12405,JANE ST AT ST MARKS RD,-79.48902837959,43.6604130296528,2,13465287,,2024-02-07
2909,12406,ROSEDALE VALLEY RD AT DRWY E OF PARK RD (PX 2013),-79.38406900436078,43.67350000407877,2,13462900,2013,2002-03-05
2910,12407,ST MARKS RD AT WATSON AVE,-79.4902714304613,43.6601639759512,2,13465323,,2002-03-06
2911,12409,BROOKSIDE AVE AT ST MARKS RD,-79.4914949700662,43.6599016842941,2,13465372,,2002-03-06
2912,12411,BRAMBLEBROOK AVE AT MCNICOLL AVE (PX 2230),-79.2867689940512,43.81439199972685,2,13442211,2230,2018-12-13
2913,12413,FRONT ST E AT MARKET ST,-79.3721671516195,43.6491415977702,2,13466840,,2022-03-24
2914,12429,TIAGO AVE AT WESTVIEW BLVD,-79.307044529491,43.7111249193637,2,13456165,,2013-06-04
2915,12430,GLENVALE BLVD AT HANNA RD,-79.3740206027957,43.7169290812858,2,13455383,,2002-03-11
2916,12441,LONSDALE RD AT ORIOLE PKWY,-79.4008692856139,43.6911975493687,2,13459765,,2022-10-27
2917,12451,BAYVIEW AVE AT CRAIG CRES,-79.3773850401063,43.7123990758843,2,13456136,,2005-10-24
2918,12492,CORPORATE DR W/B E OF CONSILIUM PL,-79.25,43.779935,1,6341027,2507,2024-04-21
2919,12563,FREDERICK ST AT FRONT ST E,-79.3690740287773,43.6501001805573,2,13466685,2637,2022-03-24
2920,12568,GEORGE ST AT QUEEN ST E,-79.3720473032044,43.6539653546431,2,13466082,,2022-10-18
2921,12569,ONTARIO ST AT QUEEN ST E,-79.3671636381504,43.6550181001773,2,13465894,,2020-01-25
2922,12571,BERKELEY ST AT QUEEN ST E,-79.3657560892623,43.6553401895472,2,13465843,,2020-01-25
2923,12572,GEORGE ST AT KING ST E,-79.3706937991012,43.6507322364405,2,13466590,1965,2017-05-17
2924,12573,FREDERICK ST AT KING ST E,-79.3694740452578,43.651001611115,2,13466537,,2024-05-08
2925,12575,KING ST E AT PRINCESS ST,-79.3670310491324,43.6515390121226,2,13466439,,2016-07-12
2926,12576,KING ST E AT ONTARIO ST,-79.366059144905,43.6517548282251,2,13466404,,2020-01-25
2927,12578,BERKELEY ST AT KING ST E,-79.3643860801482,43.6521298325392,2,13466333,1966,2020-01-25
2928,12801,LONSMOUNT DR AT TICHESTER RD,-79.4174143897321,43.6857837621216,2,13460794,,2003-11-11
2929,12802,MURDOCK AVE AT WEST LYNNE AVE,-79.3156470282685,43.683125623606,2,13461000,,2002-04-04
2930,12892,DUPONT ST E/B W OF HAMMOND PL,-79.4185561958531,43.6722348649402,2,20006124,1721,2023-11-25
2931,12897,GILMOUR AVE AT WOODSIDE AVE,-79.4767368724866,43.6584019624475,2,13465584,,2002-04-04
2932,12898,GLENDONWYNNE RD AT QUEBEC AVE,-79.4696509034259,43.6594868084972,2,13465393,,2004-11-25
2933,12899,MARTIN GROVE RD AT MILKWOOD AVE (PX 1959),-79.58855799504757,43.730115000596705,2,13453918,1959,2023-11-29
2934,12902,REXDALE BLVD AT 71 REXDALE BLVD,-79.5626116751891,43.7126596451529,2,13456483,,2022-12-17
2935,13035,DALECREST DR AT SELWYN AVE,-79.3069459588891,43.709081501889,2,13456497,,2002-03-18
2936,13036,CAMILLA CRES AT PHARMACY AVE,-79.2924964822463,43.7135168498574,2,13455736,,2020-11-11
2937,13052,CORINTHIAN BLVD N AT PHARMACY AVE & PINEMEADOW BLVD (PX 1465),-79.32497999691806,43.792789999170644,2,13444341,1465,2018-02-06
2938,13059,ATLAS AVE AT 65M S OF EGLINTON AVE,-79.4381567089944,43.6976738236198,2,30017547,,2002-03-19
2939,13060,BROADVIEW AVE AT ERINDALE AVE,-79.3586523529059,43.6775208346087,2,13462138,,2020-01-08
2940,13189,OLD LESLIE ST AT SHEPPARD AVE E,-79.3655514959956,43.7715009097084,2,13447154,,2019-11-26
2941,13194,BLUE RIDGE RD AT SHEPPARD AVE (PX 1956),-79.37419899452645,43.769712996135496,2,13447460,1956,2019-11-26
2942,13232,BAYVIEW MEWS LANE AT HAWKSBURY DR,-79.38354283458,43.770447285893,2,13447358,,2019-11-26
2943,13363,CARLAW AVE AT LANGLEY AVE,-79.3437099512676,43.6699373447753,2,13463378,,2015-12-08
2944,13448,NORTHCLIFFE BLVD AT ROSECLIFFE AVE,-79.4430549924513,43.6838989562377,2,13461196,,2018-03-29
2945,13464,HAVELOCK ST AT HEPBOURNE ST,-79.4315471216888,43.6583344258146,2,13465495,,2024-06-25
2946,13477,DORVAL RD AT EDNA AVE,-79.4546337263167,43.6568630997924,2,13465794,,2016-11-03
2947,13554,HUMBER COLLEGE BLVD AT HUMBERLINE DR (PX 2009),-79.60915400587061,43.732189002284215,2,13453590,2009,2020-10-29
2948,13556,ROGERS RD AT WESTMOUNT AVE,-79.4450308880851,43.6857992981935,2,13460856,,2004-04-08
2949,13557,ROSECLIFFE AVE AT WESTMOUNT AVE,-79.4441282377422,43.6836721938162,2,13461241,,2002-05-08
2950,13559,NORTHCLIFFE BLVD AT ROGERS RD,-79.4439721378385,43.6860344203186,2,13460815,,2022-05-12
2951,13562,CLOVERLAWN AVE AT NORTHCLIFFE BLVD,-79.4421664909596,43.6817481062535,2,13461584,,2018-03-29
2952,13565,CLOVERLAWN AVE AT WESTMOUNT AVE,-79.4432867065704,43.6815101867693,2,13461632,,2024-06-12
2953,13566,ST CLAIR AVE AT WESTMOUNT AVE,-79.4420136861416,43.6781805919438,2,13462242,,2004-04-08
2954,13804,LAWRENCE AVE E AT FLERIMAC RD & MORNING DEW RD,-79.1688820263794,43.7723032334858,2,13446621,,2023-10-17
2955,13811,BOOTH AVE AT LAKE SHORE BLVD,-79.3407887127677,43.6535242906248,2,13466078,,2004-04-27
2956,13868,ROWENA DR AT VICTORIA PARK AVE (PX 2059),-79.3130240052738,43.751497997485636,2,13449947,2059,2011-11-01
2957,13871,CONLINS RD & SHEPPARD AVE E,-79.1900844238224,43.8041946924047,2,13442883,2074,2023-04-01
2958,13900,FERRIS RD AT NOTLEY NTCS,-79.307306287657,43.7022968344343,2,13457606,,2002-05-08
2959,13901,FERRIS RD AT NOTLEY S TCS,-79.3071320572811,43.7009021166193,2,13457837,,2002-05-09
2960,13904,KING ST W AT SPENCER AVE,-79.4308833723968,43.6382264907792,2,13468465,1984,2015-10-07
2961,13986,LESLIE ST AT RAVEL RD (PX 1233),-79.36838800368254,43.79155499937598,2,13444586,1233,2022-01-25
2962,14102,MAPLE GROVE AVE E/B W OF BROCK AVE,-79.4328589456399,43.6428022217433,2,13467915,,2024-04-30
2963,14158,DIXON AVE AT WOODBINE AVE,-79.3064751614111,43.6704359520716,2,13463206,,2002-05-29
2964,14159,QUEEN ST E AT BOARDWALK DR & RAINSFORD RD,-79.3069179084722,43.6684999748901,2,13463544,,2002-11-26
2965,14164,BROOKMOUNT RD AT JOSEPH DUGGAN RD & QUEEN ST E,-79.3080479386808,43.6682453130962,2,13463603,,2002-11-18
2966,14277,CRAWFORD ST AT DUNDAS ST W,-79.4170702372387,43.6500687255106,2,13466798,,2017-04-11
2967,14279,BUCKLAND RD AT SHEPPARD AVE,-79.5034011819604,43.7410764571488,2,13451999,,2002-06-06
2968,14415,DUPONT ST AT GALLERIA MALL ENTRANCE,-79.43984047944436,43.6685,1,30145959,,2004-07-19
2969,14443,REGAL RD AT SPRINGMOUNT AVE,-79.4352782783709,43.6752907577942,2,13462715,,2002-06-12
2970,14507,STRATHALLAN BLVD AT PROUDFOOT AVE,-79.4203332112615,43.7131541274791,2,13456112,,2002-07-30
2971,14541,FOXLEY ST AT GROVE AVE,-79.4224393941317,43.6473492849395,2,13467262,,2002-08-12
2972,14542,FRONT ST W AT LOWER SIMCOE ST & SIMCOE ST (PX 263),-79.38502100412926,43.64477500424289,2,13467593,263,2022-02-26
2973,14543,MURRAY GLEN DR AT WARDEN AVE,-79.2990666985104,43.7560598190134,2,13449240,,2002-06-25
2974,14544,HOMEWOOD AVE AT MAITLAND PL,-79.375508036279,43.6656999001322,2,13464190,,2015-05-21
2975,14545,DOVERCOURT RD AT SUDBURY ST,-79.4216554009512,43.6414741860081,2,13468060,,2022-11-02
2976,14548,BLOSSOMFIELD DR AT LAWRENCE AVE W,-79.4484080585104,43.7152130739873,2,13455830,1895,2020-03-04
2977,14661,MOUNT PLEASANT RD AT ROEHAMPTON AVE (PX 1972),-79.3906569979648,43.70961500317894,2,13456611,1972,2021-03-10
2978,14746,LAWRENCE AVE E AT CEDARBRAE MALL E TCS & 245M W OF MARKHAM R,-79.2291988688601,43.75899452810141,1,11485087,1696,2012-06-25
2979,14859,INDIAN RD AT WESTMINSTER AVE,-79.4539108979642,43.6463511853615,2,13467493,,2002-09-05
2980,14863,PLAINS RD AT REDNOR RD,-79.319406011316,43.6979573882106,2,13458295,,2015-05-25
2981,14866,ABBOTT AVE AT INDIAN RD CRES,-79.4595528064657,43.6599155571487,2,13465300,,2002-10-24
2982,14867,HOWARD PARK AVE AT INDIAN GRV,-79.4565859505623,43.6499050532325,2,13466905,,2022-12-13
2983,14868,SHIRLEY ST AT ST CLARENS AVE,-79.4375545982369,43.6481310471144,2,13467167,,2022-09-22
2984,14869,GIBSON AVE AT RICHWOOD ST & WRIGHT AVE,-79.5060988634269,43.7001825849971,2,13458342,,2002-09-16
2985,14877,NEILSON RD AT NEILSON PARK DRIVE,-79.2245415092525,43.8106137022859,2,13442392,,2002-09-12
2986,14878,PALMDALE DR AT SHEPPARD AVE E,-79.3112140099049,43.7779861561199,2,13446173,,2011-09-26
2987,14883,BIRCHMOUNT RD AT GLENDOWER CRCT & TIMBERBANK BLVD (PX 1165),-79.30515799396044,43.79711500414756,2,13443775,1165,2016-12-07
2988,14937,HUMBER COLLEGE BLVD AT WESTMORE DR (PX 2204),-79.59945100425746,43.730907997879015,2,13453815,2204,2014-11-24
2989,14944,CHAMPAGNE DR AT CHESSWOOD DR,-79.4765904968413,43.7643189701971,2,13448440,1973,2016-11-02
2990,14945,SWANWICK AVE AT VICTORIA PARK AVE,-79.285859731587,43.6851610425614,2,13460543,,2021-10-14
2991,14946,BINGHAM AVE AT SWANWICK AVE,-79.2868278573255,43.6849392147103,2,13460593,,2002-10-10
2992,14947,DUPONT ST AT KENDAL AVE,-79.4094477658967,43.6742126246196,2,13462842,,2019-03-28
2993,14966,QUEEN ST W AT PALMERSTON AVE & TECUMSETH ST,-79.4065758480014,43.6466829318926,2,13467348,1969,2024-07-23
2994,14967,LOBB AVE AT SHAW ST (PX 1970),-79.41713599616415,43.64694299560295,2,13467329,1970,2010-01-14
2995,14976,LUMSDEN AVE AT OAK PARK AVE,-79.3103728942289,43.6939246303358,2,13458996,,2011-10-11
2996,14977,GLEDHILL AVE AT LUMSDEN AVE (PX 2242),-79.31157000602887,43.69362600288538,2,13459054,2242,2022-10-19
2997,14978,MORTIMER AVE AT WOODMOUNT AVE (PX 2179),-79.31820000076186,43.691975002264535,2,13459399,2179,2022-02-16
2998,14979,BROADVIEW AVE AT BROWNING AVE,-79.357731142185,43.6810082951849,2,13461510,,2018-04-11
2999,14980,DANFORTH AVE AT ELLERBECK ST,-79.3564125137718,43.6766788051942,2,13462292,,2002-09-23
3000,14982,DANFORTH AVE AT JACKMAN AVE,-79.3532967635981,43.6772868665907,2,13462166,,2002-09-23
3001,15007,COLVILLE RD AT SHEFFIELD ST,-79.4713920398985,43.7075116078279,2,13457109,,2002-10-09
3002,15148,INDIAN RD AT KENNETH AVE,-79.4583455042407,43.661399967459,2,13465063,,2002-10-28
3003,15390,BAY ST AT CRITCHLEY LANE & MAYFAIR MEWS,-79.3897073857328,43.6702749171976,2,14014179,,2002-10-21
3004,15414,CRAWFORD ST AT SHANK ST,-79.4140669108508,43.6423681058408,2,13467939,,2002-10-28
3005,15523,LEEDS ST AT SHAW ST,-79.4241178666887,43.6645968039892,2,13464493,,2013-09-25
3006,15524,IRENE AVE AT SHAW ST,-79.4235212189558,43.6631296830882,2,13464712,,2002-11-06
3007,15787,FINCH AVE AT NO FRILLS DRWY & 390 M W OF KIPLING AVE (PX 1856),-79.58617146936108,43.74337686297885,1,906898,2686,2009-12-10
3008,15856,HAMBLY AVE AT WILLIAMSON RD,-79.2981716791944,43.6737785829183,2,13462646,,2017-02-21
3009,15857,FRATER AVE AT WOODMOUNT AVE,-79.3178429043696,43.6912791738217,2,13459521,,2006-02-14
3010,15858,BARRON RD AT TIAGO AVE,-79.3035580119178,43.7118258227909,2,13456050,,2002-11-18
3011,15993,CHILTON RD AT O CONNOR DR,-79.3472122303037,43.6938425107736,2,13459113,,2002-11-26
3012,15994,BRANT ST AT RICHMOND ST W (PX 2023),-79.39865600135796,43.64747400315526,2,13467191,2023,2022-07-06
3013,16007,LAKE SHORE BLVD AT NORTHERN DANCER BLVD (PX 1811),-79.30975200344966,43.663396001490334,2,13973019,1811,2022-02-09
3014,16008,LARK ST AT QUEEN ST E & WINNERS CIRCLE,-79.3103355499991,43.6677315100072,2,13463707,,2002-11-18
3015,16018,O CONNOR DR AT RIVERCOURT BLVD (PX 2027),-79.34825199421549,43.69363700114992,2,13459158,2027,2010-06-01
3016,16021,CALEDONIA RD AT CORBY AVE,-79.4587032206828,43.6846601701622,2,13461089,,2024-02-13
3017,16073,LAWRENCE AVE AT SOUTH STATION ST,-79.5153239757497,43.7003548421998,2,13458331,,2024-07-25
3018,16148,NORTHERN DANCER BLVD AT QUEEN ST E,-79.3114402780566,43.6674933171033,2,13973030,,2002-12-02
3019,16163,RONAN AVE AT SNOWDON AVE,-79.3962315645363,43.7326852156116,2,13453076,,2002-12-18
3020,16164,AVONDALE AVE AT BALES AVE (PX 2521),-79.40889099559439,43.75848499690795,2,13449113,2521,2019-03-27
3021,16255,DINNICK CRES AT POTE AVE,-79.3973660508068,43.7229059534979,2,13454531,,2003-01-13
3022,16256,CARLTON ST AT ONTARIO ST,-79.3705204516656,43.6637226976273,2,13464520,1992,2023-07-25
3023,16257,JANE ST AT 360M N OF SHOREHAM DR (PX 1727),-79.5208999986981,43.77110999764564,1,439138,1727,2018-04-04
3024,16259,CARUS AVE AT OSSINGTON AVE,-79.430213068638,43.6729410516646,2,13463104,,2003-02-04
3025,16267,MARTIN GROVE RD AT HIGHWAY 401 W/B OFF N OF REXDALE (PX 788),-79.57153100178142,43.692903996026004,2,13459849,788,2016-05-03
3026,16271,GEARY AVE AT OSSINGTON AVE,-79.4295926624469,43.6714341642127,2,13463330,,2020-01-15
3027,16272,DUFFERIN ST AT EVERSFIELD RD,-79.4468102537644,43.6872481077686,2,13460575,,2019-06-25
3028,16274,BLOOR ST W AT RIVERSIDE DR E,-79.488136552528,43.6477280414199,2,13467355,,2024-04-30
3029,16283,YONGE ST AT ERSKINE AVE & ROSELAWN AVE,-79.3992775114524,43.7110937852378,2,13456388,,2023-04-25
3030,16286,HORSHAM AVE AT YONGE ST,-79.4143844536036,43.7751570559166,2,13446725,,2003-01-30
3031,16288,BARDS WALKWAY AT SHEPPARD AVE E,-79.3345784256012,43.7754903611054,2,13446542,,2008-05-12
3032,16290,CURRAN DR AT GLEN ALBERT DR,-79.3014788837426,43.7024086495106,2,13457571,,2003-01-16
3033,16291,HAMPTON AVE AT SPARKHALL AVE,-79.3506556146968,43.6721563658575,2,13463048,,2003-01-22
3034,16292,BROOKSIDE AVE AT ST JOHNS RD,-79.4921372213205,43.6614517348845,2,13465132,,2020-01-15
3035,16294,GILMOUR AVE AT VERNON ST,-79.4784597254052,43.6635721052733,2,13464766,,2003-02-06
3036,16315,DEXTER BLVD AT LESLIE ST,-79.3702980859663,43.7996075422505,2,13443611,,2003-02-13
3037,16316,DON AVON AVE AT DONLEA AVE,-79.3626695296116,43.7149584679077,2,13455665,,2003-02-20
3038,16317,GLENDALE AVE AT MERRICK ST,-79.4512368458849,43.640662739099,2,13468215,,2022-04-06
3039,16318,BOON AVE AT ROGERS RD (PX 2496),-79.44928899661168,43.68471699620743,2,13461051,2496,2017-11-14
3040,16321,CHAMBERLAIN AVE AT SCHELL AVE,-79.4577628238295,43.6979424007171,2,13458626,,2003-03-27
3041,16322,MUSGRAVE ST AT VICTORIA PARK AVE (PX 1846),-79.28700199567825,43.687938997964196,2,13460032,1846,2020-02-13
3042,16323,BLOOR ST AT MONTROSE AVE (PX 1928),-79.42091399636405,43.66302499672006,2,13464722,1928,2020-10-01
3043,16337,BARRINGTON AVE AT SECORD AVE,-79.3023788653713,43.6926449407636,2,13459233,,2011-12-20
3044,16342,ROEHAMPTON AVE AT LANEWAY WEST OF BAYVIEW AVE,-79.3780449736938,43.7119005808631,2,14023868,,2003-03-26
3045,16343,GLAZEBROOK AVE AT LANEWAY WEST OF BAYVIEW AVE,-79.3782074841494,43.7129303995266,2,14023849,,2003-03-26
3046,16350,HEPBOURNE ST AT RUSHOLME RD,-79.4302400597545,43.6586090409043,2,13465448,,2021-10-19
3047,16351,DEWSON ST AT RUSHOLME RD,-79.4291318091021,43.6558125398576,2,13465908,,2024-06-25
3048,16352,BYWOOD DR AT KIPLING AVE,-79.5417774945525,43.6565755513176,2,13466027,,2012-01-25
3049,16355,BABY POINT RD AT HUMBERCREST RD,-79.4925664506404,43.6576790831302,2,13465746,,2003-03-31
3050,16356,DUFFERIN ST AT LINDSEY AVE,-79.4329422162934,43.6536096058227,2,13466262,2612,2023-05-02
3051,16357,BATHURST ST AT FORT YORK BLVD (PX 1919),-79.40064899812594,43.63883899913726,2,14255097,1919,2018-10-03
3052,16358,FLEET ST AT FORT YORK BLVD (PX 1918),-79.40684100491526,43.636392002599784,2,14255084,1918,2011-09-28
3053,16359,FORT YORK BLVD AT LAKE SHORE BLVD (PX 1917),-79.40671400490861,43.63547999587122,2,14255079,1917,2024-06-18
3054,16360,COLLEGE ST AT GLADSTONE AVE,-79.4310547531073,43.6528508388676,2,13466374,2486,2022-12-14
3055,16361,BLOOR ST AT GLADSTONE AVE,-79.4338181201617,43.660198780947,2,13465209,,2023-01-18
3056,16364,BLOOR ST W AT RUSHOLME RD,-79.4311320991419,43.6607909230365,2,13465105,,2003-04-01
3057,16365,KIPLING AVE AT REDWATER DR (PX 2205),-79.5685320049904,43.71556800358204,2,13456030,2205,2022-02-08
3058,16375,CLENDENAN AVE AT ROWLAND ST,-79.4714103479382,43.660303909206,2,13465267,,2003-04-29
3059,16485,OVERLAND DR AT THE DONWAY W (PX 2193),-79.34672499429222,43.733013002259725,2,13452922,2193,2019-04-16
3060,16486,GLENHURST AVE AT OAKWOOD AVE,-79.4365991024558,43.6818671577101,2,13461551,,2023-11-16
3061,16487,CULFORD RD AT MAPLE LEAF DR,-79.490155811819,43.7123609740942,2,13456379,,2023-03-28
3062,16654,BARTLETT AVE AT BLOOR ST W,-79.432886797554,43.6604027755343,2,13465174,,2023-01-18
3063,16655,BARTLETT AVE AT HALLAM ST,-79.4353612207338,43.6663820366891,2,13464224,,2021-10-14
3064,16670,GLADSTONE AVE AT HALLAM ST,-79.4366529423094,43.6661058787082,2,13464268,,2021-10-14
3065,16674,HALLAM AVE AT SALEM AVE,-79.4341276623469,43.6666516966239,2,13464172,,2021-10-14
3066,16675,HALLAM ST AT WESTMORELAND AVE,-79.4328957518561,43.6669237385564,2,13464115,,2021-10-14
3067,16676,BLOOR ST AT WESTMORELAND AVE,-79.4304208808964,43.6609451354497,2,13465074,,2003-05-12
3068,16678,DUNDAS ST W AT GOOCH AVE,-79.4986135542773,43.6656052334101,2,13464494,,2022-10-20
3069,16679,FINCH AVE W AT HALSIA DR & WOODBINE DOWNS BLVD (PX 1848),-79.60671800176651,43.733721997800004,2,13453318,1848,2024-04-16
3070,16693,DUPONT ST E/B W OF LANSDOWNE AVE,-79.44754,43.6665,1,11394969,2441,2023-11-25
3071,16751,CHURCH ST AT MAITLAND ST (PX 2016),-79.38052000050898,43.66464699734577,2,13464377,2016,2017-01-18
3072,16758,GLENGROVE AVE AT MARLEE AVE,-79.4445172696834,43.7107312874545,2,13456552,,2024-05-14
3073,20167,HUMBERVIEW RD AT RIVERCREST RD,-79.4881875481819,43.6536182311893,2,13466373,,2003-05-21
3074,20168,BARKER AVE AT FIARSIDE AVE,-79.3260749222452,43.6921525643511,2,13459390,,2003-05-26
3075,20249,ISLINGTON AVE AT WARDLAW CRES,-79.5663410859638,43.7393890142813,2,13452385,,2012-11-28
3076,20266,BRUCE PARK AVE AT ROEHAMPTON AVE,-79.3805966301509,43.7114704310595,2,13456293,,2018-08-29
3077,20279,GOODWILL AVE AT WILSON HEIGHTS BLVD,-79.4492224101159,43.736400696862,2,13452625,,2017-02-02
3078,20280,NUGGET AVE AT SHORTING RD,-79.250940873383,43.7963991601087,2,13443768,,2024-03-05
3079,20281,ALTON AVE AT DUNDAS ST E,-79.3293839661336,43.6672891557939,2,13463823,,2024-04-16
3080,20282,DUNDAS ST E AT HIAWATHA RD,-79.3212555266968,43.6680743697603,2,13463669,,2022-11-22
3081,20285,GOULD ST AT VICTORIA ST,-79.3807354971245,43.6575285459262,2,13465504,,2003-10-09
3082,20286,ADELAIDE ST AT SHAW ST,-79.4154979782761,43.6427118279058,2,13467895,,2014-06-05
3083,20294,DUNDAS ST E AT HAMILTON ST,-79.352217044054,43.6622334260601,2,13464686,,2020-07-08
3084,20295,DUNDAS ST E AT WARDELL ST,-79.3455690483643,43.6637063308317,2,13464454,,2003-10-21
3085,20296,BARKWIN DR AT ISLINGTON AVE,-79.5657448903123,43.7381568755393,2,13452596,,2023-04-26
3086,20297,BILLINGS AVE AT DUNDAS ST E,-79.3255186339075,43.6676473441423,2,13463760,,2003-10-20
3087,20298,DUNDAS ST E AT RHODES AVE,-79.3187136960015,43.6686521679671,2,13463551,,2003-10-16
3088,20299,CURZON ST AT DUNDAS ST E,-79.3328627383683,43.6664644261523,2,13463957,,2003-10-23
3089,20300,ASHDALE AVE AT DUNDAS ST E,-79.3201710912281,43.6683158848985,2,13463622,,2022-10-19
3090,20301,BERTMOUNT AVE AT DUNDAS ST E,-79.3364317630857,43.6659260611604,2,13464051,,2016-07-25
3091,20302,NORTH QUEEN ST AT NOVA RD (PX 1927),-79.5569600030032,43.61610700245495,2,13470013,1927,2021-12-14
3092,20304,DUNDAS ST E AT HASTINGS AVE,-79.3305100977375,43.6670076851205,2,13463873,,2003-10-23
3093,20350,SHERWAY GARDENS RD AT F G GARDINER EXPY W/B OFF RAMP (PX 1871),-79.55234599740287,43.6130879994157,2,14256202,1871,2011-12-06
3094,20372,DOURO ST AT SHAW ST,-79.4147071800959,43.6406433638378,2,13468158,,2018-06-21
3095,20415,DUPONT ST AT WESTMORELAND AVE,-79.4339250302755,43.6694487169322,2,13463710,,2003-06-09
3096,20427,DUPONT ST AT GLADSTONE AVE,-79.4377503685327,43.6686659209444,2,13463845,,2003-06-09
3097,20429,DUPONT ST AT SALEM AVE,-79.4351809911062,43.6691917999074,2,13463759,,2015-10-05
3098,20431,BLOEM AVE AT DUFFERIN ST,-79.4463951371847,43.6862447995765,2,13460782,,2013-05-13
3099,20442,SCOLLARD ST AT YONGE ST,-79.3877866530401,43.6726828021495,2,13463047,,2003-06-16
3100,20470,GREER RD AT LAWRENCE AVE,-79.4087532467655,43.7237169828543,2,13454446,,2022-03-10
3101,20473,BURNHAMTHORPE RD AT OLD BURNHAMTHORPE RD (PX 1887),-79.58199699485176,43.640649997011835,2,13468412,1887,2016-11-30
3102,20493,IRENE AVE AT ROBLOCKE AVE,-79.4242908828441,43.6629638236402,2,13464737,,2003-06-23
3103,20494,KINGSTON RD AT HIGHWAY 401 W/B OFF RAMP (PX 1387),-79.14437099662197,43.80011000176936,2,13443179,1387,2018-05-26
3104,20495,THE EAST MALL AT 70M N OF CANTLE PATH & LOBLAWS ENT (PX 1840),-79.55887599847459,43.64465400270712,1,13969709,1840,2008-03-26
3105,20496,THE QUEENSWAY AT 60M E OF ALGIE AVE & IKEA ENT,-79.5355411807868,43.61897176384265,1,7336739,1892,2023-04-01
3106,20497,VICTORIA PARK AVE AT SPRINT ENTRANCE (PX 1830),-79.34047999750787,43.8136400021925,1,11467214,1830,2012-07-23
3107,20498,THE QUEENSWAY AT 230M E OF THE WEST MALL & SHERWAY ENT,-79.55928517772087,43.6140089371679,1,913972,1832,2023-04-01
3108,20499,THE QUEENSWAY AT 150M W OF ISLINGTON AVE & THEATRE ENT (PX 1863),-79.5167700018425,43.6231900027932,1,20040308,1863,2012-07-30
3109,20541,BRIAR HILL AVE AT MANITOU BLVD,-79.4288966472623,43.7075172234155,2,13457028,,2003-06-19
3110,20558,CHAPLIN CRES AT COLIN AVE,-79.3994765428272,43.6981424310257,2,13458438,,2018-07-19
3111,20856,DUPLEX AVE AT HELENDALE AVE,-79.4009955367449,43.7086564650219,2,13456803,,2021-03-04
3112,20861,DUPLEX AVE AT ORCHARD VIEW BLVD (PX 2517),-79.40083900410485,43.707760000945214,2,13456935,2517,2021-03-10
3113,20868,EDITH DR AT ROSELAWN AVE,-79.4042853988079,43.7098606213443,2,13456603,,2018-10-25
3114,20875,BLOOR ST E AT HUNTLEY ST,-79.3790683459522,43.6719153156726,2,13463150,2026,2022-10-12
3115,20878,DUPONT ST AT MANNING AVE,-79.419108308957,43.6721103005583,2,13463197,,2003-07-10
3116,20883,DUPLEX AVE AT MONTGOMERY AVE (PX 2516),-79.40106199767975,43.70916900076784,2,13456723,2516,2021-03-03
3117,20884,EDITH DR AT ORCHARD VIEW BLVD,-79.4033134722269,43.7072404701586,2,13457013,,2017-02-15
3118,20891,BIRCHMOUNT RD AT NEWLANDS AVE (PX 2012),-79.26932600349551,43.709921000093495,2,13456272,2012,2021-10-14
3119,20982,FINCH AVE E W/B W OF ADIRONDACK GATE,-79.30281274392489,43.799750430261604,1,3369767,1734,2024-06-11
3120,21007,BOND ST AT GOULD ST,-79.3789803125783,43.6579529781283,2,13465440,,2003-10-09
3121,21008,PARK RD AT ROSEDALE VALLEY RD,-79.3840007536373,43.673529045122,2,13462900,2013,2021-09-14
3122,21027,THE QUEENSWAY AT HOME DEPOT ENT( E OF NORTH QUEEN),-79.55420915789696,43.61461841148265,1,30073850,,2003-06-05
3123,21088,MEADOWVALE RD AT PARK RD & ZOO RD E TCS ( N OFF RAMP) (PX 2534),-79.17337600558554,43.81824299578336,2,13441955,2534,2024-05-04
3124,21173,MELROSE AVE / TEDDINGTON PK AVE AT YONGE ST,-79.4042668170799,43.7330139049403,2,13453048,,2019-12-11
3125,21185,HUMEWOOD DR AT VAUGHAN RD,-79.4283166072752,43.6888038187826,2,13460246,,2018-04-10
3126,21186,QUEENS QUAY AT 100M E OF YORK ST & WATERPARK PL,-79.37844000000001,43.64059,1,30141844,,2012-08-07
3127,21504,CARR ST AT DENISON AVE,-79.4013117913235,43.6496730014818,2,13466817,,2023-06-07
3128,21505,DOURO ST AT STRACHAN AVE & WELLINGTON ST W,-79.411469505987,43.6407583162869,2,13468144,2403,2017-11-27
3129,21506,BURRELL AVE AT KING EDWARD AVE,-79.311506415092,43.6906674430801,2,13459615,,2005-04-11
3130,21507,KITCHENER AVE AT NAIRN AVE,-79.4541891351193,43.6902393118257,2,13460043,,2003-08-07
3131,21666,FIRST ST AT LAKE SHORE BLVD W (PX 2004),-79.49849899626707,43.602261002210476,2,13470389,2004,2021-10-21
3132,21873,FELTHAM AVE AT SPEARS ST,-79.4804210517956,43.6764330276328,2,13462630,,2003-09-10
3133,21927,BEAMISH DR AT BLOOR ST W,-79.5373389958147,43.6413819756497,2,13468264,,2003-09-11
3134,21928,DOVERCOURT RD AT FOXLEY ST,-79.4237772359097,43.6470853556176,2,13467320,,2017-02-22
3135,21929,DON MILLS RD AT GRAYDON HALL PL,-79.3469529578775,43.7652871776005,2,13448069,,2005-06-27
3136,21930,BEAMISH DR AT DUNDAS ST W,-79.5363993250281,43.6403901830263,2,13468369,,2003-09-11
3137,21931,CONNAUGHT AVE AT EASTERN AVE,-79.3216507827038,43.6633124077788,2,13464459,,2021-10-21
3138,21932,AUKLAND RD AT SUBWAY CRES (PX 2479),-79.53707648896969,43.63776091991566,1,30134756,2632,2005-03-31
3139,21933,YONGE ST AT 280M S OF CUMMER AVE & # 5791 - 5800 YONGE (PX 2177),-79.41666000320349,43.784389999704,2,13445545,2177,2015-11-19
3140,21959,WYNFORD DR AT RAMP EGLINTON AVE W/B NTCS (PX 1463),-79.32598099536325,43.72521899948108,2,13454092,1463,2024-03-07
3141,22177,FARNHAM AVE AT WOODLAWN AVE W,-79.397495891408,43.684046640387,2,13461042,,2024-02-28
3142,22178,BLACK CREEK BLVD AT ROSE VALLEY CRES,-79.5010816150715,43.6754480734536,2,13462843,,2003-09-24
3143,22426,ARLINGTON AVE AT WINNETT AVE,-79.4357408533531,43.6948775819711,2,13459155,,2003-09-30
3144,22427,LASCELLES BLVD AT WILBERTON RD,-79.3995283542301,43.6950871785403,2,13459017,,2003-09-29
3145,22428,DEER PARK CRES AT DELISLE AVE,-79.3987855534376,43.6882676729475,2,13460272,,2012-11-21
3146,22429,BRYCE AVE AT ORIOLE GNDS,-79.3978718870289,43.6907967473137,2,13459814,,2003-09-29
3147,22430,LAWTON BLVD AT LONSDALE BLVD,-79.3960504195647,43.6921316898133,2,13459567,,2003-09-29
3148,22431,DUGGAN AVE AT LAWTON BLVD,-79.3970605535229,43.6938025148771,2,13459273,,2022-08-11
3149,22432,ALVIN AVE AT HEATH ST E,-79.3933937392003,43.6903006297226,2,13459891,,2022-08-11
3150,22433,HEATH ST W AT ORIOLE RD,-79.40069896023,43.6890353978033,2,13460138,,2009-03-12
3151,22434,ORIOLE RD AT ST CLAIR AVE W,-79.3998688572478,43.686936047298,2,13460525,,2003-09-29
3152,22435,FROBISHER AVE AT ORIOLE PKWY,-79.4030258187285,43.6973447428223,2,13458609,,2018-06-19
3153,22436,LAWTON BLVD AT YONGE ST,-79.3950322615013,43.6907693404202,2,13459811,,2022-03-03
3154,22437,PLEASANT BLVD AT YONGE ST,-79.3936837221248,43.6871211725781,2,13460473,,2022-08-11
3155,22438,DELISLE AVE AT YONGE ST,-79.3945442387554,43.6891213926552,2,13460106,,2022-08-11
3156,22439,BAKER AVE AT WALMSLEY BLVD,-79.3980118096631,43.6927318896741,2,13459457,,2003-10-09
