_id,location_id,location,lng,lat,centreline_type,centreline_id,px,latest_count_date
4424,34272,OLD DUNDAS ST AT VARSITY RD,-79.5021929474471,43.6642856335917,2,13464692,,2011-09-12
4425,34273,PORTLAND ST AT WELLINGTON ST W,-79.3995536244096,43.6431845720875,2,13467814,,2023-02-09
4426,34274,CORPORATE DR AT TOYOTA PL,-79.2445536423159,43.7808778018347,2,13445673,,2011-09-19
4427,34275,ASHMOUNT CRES AT HARTSDALE DR,-79.5438026568902,43.6860774111368,2,13461036,,2011-09-19
4428,34276,MOORE AVE AT BELTLINE TRL,-79.3806712009571,43.6947601962149,2,30004906,,2011-09-19
4429,34288,ELLESMERE RD AT GRANGEWAY AVE,-79.248804506528,43.772759106229,2,14249902,2515,2022-12-17
4430,34289,HARTSDALE DR AT HOLGATE ST,-79.5439297493105,43.6843975116201,2,13461350,,2011-09-26
4431,34290,FLEMINGTON RD AT VARNA DR,-79.4410223103861,43.7201271212569,2,13455028,,2023-06-07
4432,34291,DELORAINE AVE AT YONGE ST,-79.4044784228579,43.7339330534864,2,13452913,,2016-02-03
4433,34424,CASTLEFIELD AVE W/B E OF # 52 CASTLEFIELD AVE,-79.4012097864576,43.7114797805576,2,13456322,854,2024-06-04
4434,34487,DEERHURST AVE AT QUEENSLEA AVE,-79.5165187851567,43.7096388337992,2,13456882,,2011-10-24
4435,34488,BANBURY RD AT CARAVAN DR,-79.368553615798,43.7428484248443,2,13451434,,2011-10-25
4436,34489,BRAEBURN AVE AT SCARLETT RD,-79.5259699918827,43.7005053199436,2,13458328,,2019-04-02
4437,34490,GEARY AVE AT SOMERSET AVE,-79.4307588142145,43.6711989427194,2,13463370,,2020-01-15
4438,34500,MCCAUL ST AT QUEEN ST W,-79.3896843161321,43.6501650892032,2,13466717,2502,2017-09-19
4439,34501,BEARE RD AT PLUG HAT RD,-79.1733050646594,43.8382795703933,2,13441610,,2018-08-28
4440,34502,OLD FINCH AVE AT SEWELLS RD,-79.1995842709828,43.8252514522406,2,13441718,,2018-08-28
4441,34503,BROWNSPRING RD AT SHEPPARD AVE E,-79.2624908460989,43.7888445398435,2,13444715,,2019-06-02
4442,34504,OLD FINCH AVE AT RESSOR RD,-79.1888563780696,43.8251535487573,2,13441716,,2018-08-28
4443,34505,LOCKHEED BLVD AT SCARLETT RD,-79.525080619331,43.699705835592,2,13458462,,2023-06-16
4444,34506,FINCH AVE AT PICKERING TOWN LINE,-79.16024772490799,43.83328831704938,1,4885368,,2011-11-08
4445,34507,HOMEWOOD AVE AT WELLESLEY ST E,-79.3758529004957,43.6664862717973,2,13464056,2349,2023-10-05
4446,34508,DALESFORD RD AT GRAND AVE,-79.4936517036545,43.625877281992,2,13469523,,2022-11-02
4447,34554,BELLE AYRE BLVD AT DAVISVILLE AVE,-79.3832730643981,43.7011012007782,2,13457982,,2011-11-21
4448,34555,HAMILTON ST AT KINTYRE AVE,-79.3514007479827,43.6602613438425,2,13465005,,2011-11-14
4449,34556,MATILDA ST AT MUNRO ST,-79.3523129309475,43.6600612289098,2,20141378,,2011-11-15
4450,34617,BRIAR HILL AVE AT MARWOOD CRT,-79.4360696616231,43.7059750777807,2,13457267,,2011-12-05
4451,34619,BRENTWOOD AVE AT EASTON RD AND SHEPPARD AVE,-79.4259147152743,43.7581808892846,2,13449200,,2016-11-15
4452,34712,ELLIS AVE AT ELLIS GNDS,-79.4672094546579,43.6386840196912,2,13468468,,2022-04-06
4453,34713,HOWARD PARK AVE AT SUNNYSIDE AVE,-79.4534097114091,43.6510537537279,2,13466723,,2011-12-21
4454,34716,GARY DR AT WALWYN AVE,-79.5218581890816,43.7103976444063,2,13456787,,2011-12-07
4455,34718,CLEVELAND ST AT SOUDAN AVE,-79.3800463051492,43.7079387119823,2,13456864,,2022-04-21
4456,34719,SUTHERLAND DR AT VANDERHOOF AVE,-79.3665137475678,43.7112995716818,2,13456283,,2022-03-10
4457,34724,BLOOR ST W AT 30 M W OF BRULE TERRACE,-79.4908443534283,43.6481014959622,2,13467295,,2024-04-30
4458,34742,OAKDALE RD AT 376M S OF FINCH AVE & WESTVIEW CEN SS(PX 1897),-79.5260100003446,43.753249995838225,1,10536929,1897,2012-02-07
4459,34744,BURNHAMTHORPE RD AT SHAVER AVE N,-79.5516967574606,43.6481778015461,2,13467416,,2023-11-28
4460,34775,JANE ST AT WRIGHT AVE (PX 2290),-79.50324699638787,43.70084800434216,2,13458238,2290,2018-04-03
4461,34776,ELLESMERE RD AT PACKARD BLVD,-79.2576730547967,43.7708498076382,2,13447015,,2016-03-21
4462,34779,SHAVER AVE S AT STATLER AVE,-79.5470919153396,43.6369085413155,2,13468740,,2012-02-09
4463,34780,THE WESTWAY AT TRIO AVE (PX 2208),-79.53477300535201,43.69413300417223,2,13459538,2208,2012-02-07
4464,34781,OVIDA AVE AT SHAVER AVE,-79.5460721738616,43.6344673583249,2,13469004,,2012-02-08
4465,34782,TANGIERS RD AT TORO RD (PX 2302),-79.4873339948238,43.76042100162507,2,13448994,2302,2012-02-08
4466,34786,TANGIERS ROAD AT YORK UNIVERSITY BUSWAY (PX 2303),-79.48964300284916,43.76699099899616,2,30029059,2303,2012-02-09
4467,34789,DUNDAS ST W AT GROVE AVE,-79.4232314255277,43.6493981969862,2,13466928,,2012-02-21
4468,34791,CARLAW AVE AT GERRARD ST S INT,-79.3425453399861,43.6670907858784,2,13463879,,2018-01-25
4469,34792,CARLAW AVE AT SIMPSON AVE,-79.3430925779068,43.6684468149187,2,13463661,,2018-06-13
4470,34794,DUNDAS ST W AT INDIAN GRV,-79.462277764787,43.6653794391911,2,13464433,,2023-01-24
4471,34795,MANCHESTER AVE AT OSSINGTON AVE,-79.4278604321281,43.667220785298,2,13464050,,2012-03-01
4472,34796,WARDEN AVE AT 260M N OF BERTRAND & MULTI USE TRAIL (PX 2147),-79.29064799941202,43.73535200322717,2,30020236,2147,2012-03-26
4473,34813,KENNEDY PARK RD AT MARGDON RD,-79.4732038824389,43.6527118026538,2,13466485,,2012-02-29
4474,34814,MANCHESTER AVE AT SHAW ST,-79.4254408560472,43.6677604649659,2,13463961,,2012-03-20
4475,34818,MIDLAND AVE AT 215M SOUTH OF MCNICOLL AVE (PX 2276),-79.29131099532952,43.812585995724646,2,30020021,2276,2012-04-10
4476,34819,LAWRENCE AVE AT 130M EAST OF LESLIE & LAWRENCE WKWY(PX 2265),-79.35434000393937,43.73483699558273,2,13452657,2265,2012-04-03
4477,34825,PALMER AVE AT SECORD AVE,-79.3007681708583,43.6930075251941,2,13459149,,2012-03-28
4478,34867,BATHURST ST AT 70M S OF KENTON DR (PX 2275),-79.44394999434108,43.777480000319954,2,30020084,2275,2015-03-23
4479,34868,KENNEDY ROAD AT 161M SOUTH OF MCNICOLL AVE (PX 2277),-79.30124500231044,43.810595998067534,2,30020057,2277,2018-12-18
4480,34913,RONAN AVE AT WANLESS AVE,-79.3944650777128,43.7281928645926,2,13453821,,2012-04-16
4481,34915,GARDENTREE ST AT MORNINGSIDE AVE AND PIXLEY CRES,-79.1828017840151,43.760091667265,2,13448428,,2017-06-22
4482,34928,JEFFCOAT DR AT KEARNEY DR AND ROSEFAIR CRES,-79.5874944150088,43.717938009134,2,13455673,,2012-04-26
4483,34929,BAY ST AT SCOLLARD ST (PX 2553),-79.39052960942801,43.672138028226286,2,13463143,2553,2017-05-03
4484,34930,HAZELTON AVE AT SCOLLARD ST,-79.3933550655829,43.6715322004211,2,13463230,,2012-05-03
4485,34931,CRESCENT PL AT CRESCENT TOWN PL AND MASSEY SQ,-79.2915651744211,43.6961510347969,2,13458516,,2012-09-12
4486,34932,BLOOR ST AT BRENTWOOD RD,-79.5135893370028,43.6468757979639,2,13467539,,2012-05-03
4487,34933,MELROSE ST AT ROYAL YORK RD,-79.4999264264756,43.6199050621732,2,13469830,,2023-05-02
4488,34934,ELDER AVE AT THIRTIETH ST,-79.5308248559489,43.5977626440617,2,13470554,,2023-06-27
4489,34935,MARLEE AVE AT VIEWMOUNT AVE (PX 2554),-79.4430812994178,43.707193875021545,2,13457100,2554,2019-05-15
4490,34936,CUMBER AVE AT FORDOVER DR AND MORNINGSIDE AVE,-79.1804950889411,43.7547835709701,2,13449162,2559,2018-03-22
4491,35019,GROVE AVE AT ROLYAT ST,-79.4228538654411,43.6484041383011,2,13467090,,2012-05-23
4492,35066,HUMBERSIDE AVE AT MAVETY ST,-79.4640017329519,43.6614000433109,2,13465072,,2012-06-14
4493,35067,BLOOR ST W AT BRULE TER,-79.4894023343215,43.6477930296114,2,13467351,,2022-05-10
4494,35068,HWY 401 EB AT LORD SEATON,-79.406504655722,43.7530032327766,2,13449922,,2012-06-11
4495,35150,ADELAIDE ST W AT NIAGARA ST,-79.4087730302126,43.6440838509544,2,13467713,,2023-11-14
4496,35151,ROXBOROUGH ST W AT YONGE ST,-79.390042002542,43.6782092215014,2,13462084,2306,2024-05-23
4497,35152,EASTDALE AVE AT SECORD AVE,-79.3000739576787,43.693164024735,2,13459115,,2012-06-20
4498,35153,AVENUE RD AT TRANMER AVE,-79.4064395982799,43.6995009113261,2,13458245,,2019-04-10
4499,35154,DORIS AVE AT KENNETH AVE AND OLIVE AVE,-79.4118864243956,43.7794241466483,2,13446172,,2012-06-26
4500,35155,BOGERT AVE AT YONGE ST,-79.4107525203177,43.7607312989247,2,13448802,,2012-06-19
4501,35156,GLENDORA AVE AT JOHNSTON AVE AND YONGE ST,-79.4103394386786,43.7590533342684,2,13449042,,2012-06-25
4502,35157,KIPLING AVE AT TORLAKE CRES,-79.5236462483383,43.6141320442004,2,13470076,,2012-07-18
4503,35189,CRESCENT TOWN RD AT MASSEY SQ W,-79.2951351716193,43.6960802487686,2,13458549,,2023-04-18
4504,35203,STRACHAN AVE AT FG GARDINER UNDERPASS,-79.40938991937581,43.637420000000006,1,1147127,,2012-08-14
4505,35204,BATHURST ST AT FG GARDINER UNDERPASS,-79.40016500000002,43.637855,1,1147077,,2012-08-13
4506,35246,GRANTBROOK ST 55M N OF BLAKE AVE (PX 2266),-79.43275200408657,43.78053899846711,2,30020099,2266,2012-07-11
4507,35262,DAN LECKIE WAY AT FG GARDINER UNDERPASS,-79.3979926076789,43.6370491565616,2,13468537,,2012-08-14
4508,35267,COPPERFIELD RD AT MANSE RD,-79.1717492025535,43.7598266896592,2,13448445,,2022-02-01
4509,35268,GLEN ROBERT DR AT PLAXTON DR,-79.301400902812,43.7047806559619,2,13457159,,2012-09-04
4510,35269,BEECHGROVE DR AT COPPERFIELD RD,-79.1515654027282,43.7637909983552,2,13447842,,2022-02-01
4511,35270,KIPLING AVE AT NAMCO RD,-79.565096830044,43.7082252683378,2,13457183,,2023-09-19
4512,35315,HILLSIDE AVE AT ROYAL YORK RD,-79.4958867266553,43.6102041339253,2,13470172,,2021-12-01
4513,35317,ST MARKS RD AT VARSITY RD,-79.4948888076164,43.6593911410076,2,13465461,,2019-12-19
4514,35318,ELSWICK RD AT HACKBERRY ST,-79.3239397455761,43.7061200417639,2,13457010,,2012-09-20
4515,35319,HACKBERRY ST AT WOODBINE HTS,-79.3216600958005,43.7066297062303,2,13456933,,2012-09-13
4516,35337,EDERNO CRT AT EDEN VALLEY DR AND POPLAR HEIGHTS CRES,-79.5327330041863,43.680161351783,2,13462077,,2012-09-24
4517,35338,HACKBERRY ST AT WHITE PINE AVE,-79.3228139694217,43.7063713549638,2,13456966,,2012-09-25
4518,35339,KENNARD AVE AT WILMINGTON AVE,-79.456249729734,43.7612151108294,2,13448819,,2023-10-05
4519,35340,ARROW RD AT DEERHIDE CRES (NORTH INT),-79.532792354308,43.749487873219,2,13450698,,2020-02-12
4520,35341,LAKE SHORE BLVD W AT REES ST,-79.3868564499766,43.6395189263217,2,13468256,,2012-08-25
4521,35352,EGLINTON AVE W AT SCOTT RD,-79.4727017012428,43.6906924254122,2,13460008,,2024-03-20
4522,35356,DOUGLAS DR AT STANDISH AVE,-79.3702731456916,43.687419014239,2,13460346,,2012-10-11
4523,35357,MACLENNAN AVE AT WHITHALL RD,-79.3779222768543,43.6851140681249,2,13460816,,2012-10-10
4524,35358,LAWTON BLVD AT WAMSLEY BLVD,-79.3966681110267,43.6930191923563,2,13459408,,2012-10-15
4525,35359,TALBOT RD 22 M N OF BLAKE AVE (PX 2267),-79.42388599749373,43.78196100305827,2,30020370,2267,2012-10-16
4526,35365,CHERRY ST AT FG GARDINER UNDERPASS,-79.35604500000001,43.649045,1,30085893,,2012-08-23
4527,35366,DORIS AVE AT 50M S OF HOLLYWOOD AVE (PX 2323),-79.40908500442926,43.7657750033904,2,30053441,2323,2012-10-18
4528,35367,DELAWARE AVE AT DEWSON ST,-79.4261776214661,43.6564376594291,2,13465805,,2012-11-12
4529,35368,MARLEE AVE AT HILLMOUNT AVE,-79.4434212178198,43.7081101390895,2,13456962,,2012-11-06
4530,35369,DUNDAS ST W AT GORE VALE AVE,-79.4135009967015,43.6507821117393,2,13466675,,2012-11-07
4531,35370,CLINTON ST AT HENDERSON AVE,-79.413468705657,43.6541825301199,2,13466127,,2018-03-28
4532,35371,GLEN PARK AVE AT MARLEE AVE,-79.4441713874631,43.7098695178247,2,13456704,,2012-10-31
4533,35401,PATON RD AT SYMINGTON AVE AND ERNEST AVE,-79.4486852663723,43.6595769123561,2,13465326,,2013-10-02
4534,35402,STAINES RD AT SEASONS DR,-79.2236876150029,43.8304944228267,2,14249113,,2012-11-21
4535,35403,BELGREEN AVE AT HUNTINGWOOD DR,-79.2906511385074,43.795469779362,2,13443961,,2012-11-26
4536,35404,HUMBERWOOD BLVD AT KINGSPLATE CRES,-79.6158494907344,43.7238882937608,2,13454800,,2022-11-17
4537,35405,CHURCH ST AT GLOUCESTER ST (PX 2530),-79.38163828570931,43.66737299103726,2,13463924,2530,2017-05-24
4538,35406,BARKER AVE AT COXWELL AVE,-79.3271150974161,43.6919267876238,2,13459424,,2017-02-08
4539,35407,BAYVIEW AVE AT HILLCREST AVE,-79.3893860928262,43.7725456100829,2,13447057,,2021-12-14
4540,35408,EGLINTON AVE W AT STRATHEARN RD,-79.4348037308322,43.6990295162249,2,13458376,,2024-05-08
4541,35589,BERMONDSEY RD AT MOBILE DR,-79.3137811816417,43.7252276697364,2,13454065,,2013-01-08
4542,35590,COLBECK ST AT EVANS AVE,-79.4838654338622,43.6534273691876,2,13466394,,2013-01-09
4543,35591,ARMADALE AVE AT COLBECK ST,-79.4849087874204,43.6532007585109,2,13466437,,2013-01-10
4544,35592,GARAMOND CRT AT WYNFORD DR (PX 2472),-79.33342999930701,43.72563200284998,2,13454051,2472,2017-04-05
4545,35593,FOUNTAINHEAD RD AT SENTINEL RD,-79.5005208790154,43.7622409949302,2,13448751,,2017-04-27
4546,35594,BARTLEY DR AT HOBSON AVE,-79.3103187978564,43.7218375269512,2,13454498,,2019-10-16
4547,35597,MARKHAM RD AT TURBINA AVE,-79.2493040983839,43.8273132787925,2,13441683,,2016-02-02
4548,35598,CARLAW AVE AT COLGATE AVE,-79.3405771072848,43.6622723335674,2,13464662,,2013-01-31
4549,35601,NORTH QUEEN ST AT 137M W OF INDEX ROAD & PRIVATE ACCESS (PX 2309),-79.55526999675013,43.619120001802294,1,5999365,2309,2013-02-05
4550,35602,ALNESS ST AT DOLOMITE DR,-79.4756226416969,43.7795733911562,2,13446259,,2015-11-19
4551,35636,DRAYCOTT DR AT SLOANE AVE,-79.3100273569011,43.7315540057873,2,13453066,,2013-02-06
4552,35637,WOLVERLEIGH BLVD AT WOODBINE AVE,-79.3134765071305,43.6872874649028,2,13460228,,2013-01-17
4553,35697,DUFFERIN ST AT GLEN PARK AVE,-79.4533973271771,43.7079075404885,2,13457018,,2017-09-07
4554,35741,CEDARCROFT BLVD AT TORRESDALE AVE,-79.4505113849105,43.7828537854271,2,13445795,,2012-12-17
4555,35742,DAVISVILLE AVE AT LE MAY RD,-79.3764390096829,43.7025072455393,2,13457734,,2013-03-05
4556,35745,CLARENCE SQ AT WELLINGTON ST,-79.3931282488456,43.6444331767933,2,13467644,,2013-03-20
4557,35747,HUMBERWOOD BLVD AT VIEW GREEN CRES AND WESTOWANIS DR,-79.6207773104986,43.7242547643862,2,14069326,,2023-03-28
4558,35748,BUSHEY AVE AT WESTON RD,-79.4831580950963,43.6838701964547,2,13461298,,2019-06-20
4559,35749,DRIFTWOOD AVE AT YORKWOODS GATE,-79.5128111399085,43.751472853086,2,13450383,,2013-03-21
4560,35750,BEVERLEY ST AT CECIL ST,-79.3951210587349,43.6569639165242,2,13465640,,2020-02-11
4561,35751,BERTAL RD AT INDUSTRY ST,-79.4893908648077,43.6917420524868,2,13459865,,2013-03-28
4562,35752,FINCH AVE AT TOPCLIFF AVE,-79.5095541971303,43.7589115887596,2,13449253,,2018-03-20
4563,35809,DONLANDS AVE AT PLAINS RD,-79.3424569570195,43.6930314573404,2,13459268,,2018-04-18
4564,35810,CECIL ST AT ROSS ST,-79.3962882505477,43.6567241142849,2,13465678,,2013-04-02
4565,35812,D ARCY ST AT SPADINA AVE,-79.398427359226,43.6539024276164,2,13466135,,2013-03-20
4566,35813,D ARCY ST AT HURON ST,-79.3965468338513,43.654311356034,2,13466080,,2013-03-27
4567,35814,LEAHURST DR AT PHARMACY AVE,-79.2940819474594,43.7173451247342,2,13455134,,2013-04-09
4568,35816,BEVERLEY ST AT D ARCY ST,-79.3942274359597,43.6547993211998,2,13465998,,2020-02-11
4569,35817,DUNDAS ST W AT SIMCOE ST,-79.3892248762734,43.6546843524145,2,13466007,,2013-04-08
4570,35818,CECIL ST AT SPADINA AVE,-79.399301670597,43.656102330762,2,13465799,,2013-03-21
4571,35823,EAST AVE AT GOLDERS GREEN AVE,-79.1332039144574,43.7844633212095,2,13445028,,2013-04-15
4572,35824,EAST AVE AT EAST WILLOW GT AND MASTWOOD CRES,-79.134432657766,43.7873744548573,2,13444651,,2013-04-15
4573,35825,EAST AVE AT FANFARE AVE,-79.1365124180392,43.7923676077209,2,13444054,,2019-11-12
4574,35826,EAST AVE AT ISLAND RD,-79.1388930203493,43.7980947026587,2,13443365,,2022-04-19
4575,35893,BISHOP TUTU BLVD AT STADIUM RD,-79.4013224635985,43.6352092801752,2,13468720,,2013-05-01
4576,35895,BISHOP TUTU BLVD AT QUEENS QUAY W,-79.3992185456578,43.6352518935829,2,13468707,,2013-04-30
4577,35896,GLENROSE AVE AT WELLAND AVE,-79.3792349863298,43.6902327653651,2,13459866,,2013-04-11
4578,35897,ROSE PARK DR AT WELLAND AVE,-79.379975116054,43.6920801967653,2,13459531,,2022-04-07
4579,35898,BEACONHILL RD AT SILVERSTONE DR,-79.5913183962242,43.7524812940211,2,13450381,,2024-04-09
4580,35962,AMSTERDAM AVE AT WESTVIEW BLVD,-79.3048725541509,43.7138803256825,2,13455707,,2020-07-16
4581,35963,AVENUE RD AT FARNHAM AVE,-79.4001642502436,43.6834941974118,2,13461150,,2022-03-08
4582,35964,QUEEN ST W AT RYERSON AVE,-79.4020176727336,43.6475954639128,2,13467174,,2013-05-08
4583,35965,GALLOWAY RD AT WALDOCK ST,-79.1930559157381,43.7581661830487,2,13448701,,2017-09-05
4584,35968,SYMINGTON AVE AT WALLACE AVE,-79.4493552001091,43.6612923274455,2,13465061,,2022-04-06
4585,35972,EGLINTON AVE AT EXPLORER DR,-79.5937292327399,43.6600795982978,2,13465544,,2012-03-22
4586,35978,ALGONQUIN AVE AT INDIAN RD,-79.4532636190567,43.6436160274073,2,13467851,,2023-05-02
4587,35979,DUNDAS ST W AT PARKWAY AVE,-79.4468090926136,43.6515898744376,2,13466617,,2013-06-03
4588,35980,MARIE LABATTE ROAD AT THE DONWAY,-79.3472083492086,43.7353781548084,2,20235446,,2019-04-16
4589,35981,MILLWOOD RD AT MOUNT PLEASANT RD,-79.3874950278364,43.701645456951,2,13457908,,2013-05-29
4590,35982,CORONATION DR AT GALLOWAY RD,-79.1939072607203,43.7601757841057,2,13448446,,2023-02-28
4591,35983,AVOCA AVE AT PLEASANT BLVD,-79.3890763369639,43.6884345670193,2,13460209,,2022-08-11
4592,35984,AVOCA AVE AT ROSEHILL AVE,-79.3883522988134,43.6873347222403,2,13460414,,2022-08-11
4593,35989,IRVING RD AT KEELE ST,-79.474508286214,43.6929951669868,2,13459609,,2020-01-22
4594,35990,BONNINGTON PL AT LYNDALE DR,-79.4068193790109,43.7615044853666,2,13448679,,2013-04-30
4595,35991,ANNDALE DR AT BONNINGTON PL,-79.4064998835952,43.7607178898687,2,13448791,,2013-04-30
4596,35992,ANNDALE DR AT TRADEWIND AVE,-79.4068112105849,43.760638015563,2,13448806,,2013-04-30
4597,35993,GLENDORA AVE AT TRADEWIND AVE,-79.4064807828721,43.7598646337232,2,13448919,,2013-04-30
4598,35994,BALES AVE AT GLENDORA AVE,-79.4091009728097,43.7592975484259,2,13449004,,2013-04-30
4599,35995,GREENSPIRE RD AT MCLEVIN AVE (PX 2567),-79.23227707216971,43.80306604904444,2,13443040,2567,2017-11-15
4600,35996,DUNDAS ST W AT ST PATRICK ST,-79.3903086358872,43.6544796355329,2,13466030,2485,2022-03-05
4601,35997,DUDLEY AVE W AT SHEPPARD AVE E,-79.4028708385056,43.7632967542212,2,13448442,,2013-06-18
4602,35998,KEELE ST AT LONBOROUGH AVE,-79.4744412775303,43.6927499927777,2,13459670,,2023-01-12
4603,35999,BEECROFT ROAD AT ELLERSLIE AVE (PX 2300),-79.41660399546159,43.770848002082865,2,30034674,2300,2013-05-02
4604,36000,BEECROFT ROAD AT KEMPFORD BLVD (PX 2305),-79.41737300540598,43.77637800392332,2,20233934,2305,2016-05-18
4605,36001,BEECROFT ROAD AT CHURCHILL AVE (PX 2299),-79.41619499601985,43.773311997822844,2,30034671,2299,2013-05-02
4606,36003,ARGYLE ST AT SHAW ST,-79.4173227055942,43.647437701838,2,13467241,,2021-10-14
4607,36004,THE EAST MALL AT VICKERS RD,-79.5517707047927,43.629561511413,2,13469372,,2013-07-15
4608,36005,WEDGEWOOD DR AT YONGE ST,-79.4178235195626,43.7889778798965,2,13444997,,2021-12-14
4609,36010,BROCK AVE AT LINDSEY AVE,-79.4367014982255,43.6527240084315,2,13466405,,2021-10-20
4610,36033,BLOOR ST AT CASTLE FRANK CRES,-79.3688335742863,43.6733306409999,2,13462893,,2013-08-21
4611,36185,FORMAN AVE AT TILSON RD,-79.3840438031484,43.7043243166408,2,13457440,,2013-08-14
4612,36186,BOWIE AVE AT CALEDONIA RD,-79.4628106357216,43.6949427018415,2,13459219,,2023-01-12
4613,36188,ARLINGTON AVE AT BENSON AVE,-79.4281974844939,43.6793738210633,2,13461974,,2013-09-17
4614,36189,BENSON AVE AT CHRISTIE ST,-79.4250571920754,43.680061243084,2,13461832,,2022-04-20
4615,36203,STRATHMORE BLVD AT WOODBINE AVE,-79.3131491940799,43.6865257893047,2,13460360,,2013-09-24
4616,36205,CONLINS RD AT LASH CRT AND MILITARY TRL,-79.1815943213052,43.7834762301745,2,13445264,,2022-04-19
4617,36206,HUGO AVE AT PERTH AVE,-79.4527434628017,43.6663102611053,2,13464267,,2016-12-06
4618,36207,FRANKLIN AVE AT HUGO AVE,-79.454488232043,43.6659630944299,2,13464337,,2013-09-23
4619,36208,EDWIN AVE AT RUSKIN AVE,-79.4539911932139,43.6620757029553,2,13464946,,2013-09-26
4620,36212,WALLACE AVE AT WARD ST,-79.4458496187291,43.6620325213019,2,13464938,,2013-09-26
4621,36214,DELAWARE AVE AT HEPBOURNE ST,-79.4272842950946,43.6592245203512,2,13465338,,2013-10-01
4622,36215,CONCORD AVE AND HEPBOURNE ST,-79.4260081241167,43.6595127977014,2,13465294,,2013-10-02
4623,36216,DURANT AVE AT MORTIMER AVE,-79.3285297722672,43.6901643856104,2,13459764,,2013-10-03
4624,36217,NEWLANDS AVE AT SANTAMONICA BLVD,-79.2718050472285,43.7093390306337,2,13456369,,2023-04-18
4625,36219,LEEDS ST AT OSSINGTON AVE,-79.4265134675233,43.6640702515581,2,13464584,,2021-09-15
4626,36220,BANGOR ROAD AT SHEPPARD AVE W,-79.4155077797288,43.7605161572574,2,13448844,,2018-11-28
4627,36222,BARTOR ROAD AT HUXLEY ROAD,-79.5240692405628,43.7242107968993,2,13454586,,2013-09-25
4628,36234,DE SAVERY CRES AT PENROSE RD,-79.3895303381103,43.7030380585603,2,13457681,,2013-10-22
4629,36235,ARLINGTON AVE AT VAUGHAN RD,-79.4318422179653,43.6888124832735,2,13460256,,2020-01-22
4630,36321,EPIC LANE RD AT WILSON AVE,-79.5062676811678,43.7212432698219,2,13454987,,2013-10-30
4631,36322,ELLESMERE RD AT SARATOGA DR,-79.2536531188543,43.7716785834206,2,13446898,,2017-03-27
4632,36329,HUMBERWOOD BLVD AT TOPBANK DR,-79.6196576796926,43.7303207426371,2,13453941,,2013-11-14
4633,36330,ADELAIDE ST W AT TECUMSETH ST,-79.4057776584858,43.6446764209133,2,13467633,,2023-11-14
4634,36331,BUSY ST AT LOGAN AVE,-79.3427376047491,43.6611665229367,2,13464846,,2013-11-20
4635,36332,DANFORTH RD AT MAGNOLIA AVE (PX 2322),-79.25562799808364,43.722715001206936,2,13454283,2322,2016-06-01
4636,36366,BUSY ST AT VERRAL AVE,-79.3410906986703,43.6615389082721,2,13464789,,2013-11-20
4637,36367,MOCCASIN TRL AT NOB LANE,-79.3367808637624,43.7309868927528,2,13453202,,2013-11-27
4638,36380,LAWRENCE AVE E AT MEADOWVALE RD (PX 2566),-79.15638987817587,43.77513812591986,2,13446227,2566,2020-11-11
4639,36419,LISCOMBE RD AT MAPLE LEAF DR AND VENICE DR,-79.4982007476358,43.7107175728889,2,13456682,,2013-12-03
4640,36436,COMMANDER BLVD AT HUNTINGWOOD DR (PX 2301),-79.26962599998066,43.79811200213962,2,13443617,2301,2014-11-10
4641,36437,BURROWS HALL BLVD AT MILLNER AVE (PX 2307),-79.21958700089719,43.79483199573012,2,13443900,2307,2013-12-09
4642,36446,RAGLAN AVE AT ST CLAIR AVE W,-79.4195149748772,43.6829205764277,2,13461313,,2013-12-17
4643,36449,MAPLEWOOD AVE AT RAGLAN AVE,-79.4208701793202,43.6861944157694,2,13460725,,2013-12-17
4644,36450,RAGLAN AVE AT LANEWAY N OF ST CLAIR AVE W,-79.4197118391853,43.6833856324835,2,14015900,,2013-12-17
4645,36461,BRACKEN AVE AT VICTORIA PARK AVE,-79.283155233091,43.6786372685676,2,13461734,,2019-05-28
4646,36462,BALMORAL AVE AT POPLAR PLAINS RD SOUTH ROADWAY,-79.4029060508757,43.6837867973419,2,13461113,,2014-01-16
4647,36463,PORTER AVE AT WESTON RD,-79.4786691663386,43.6828852798013,2,13461472,,2014-01-16
4648,36473,HONEYVIEW PL AT HUMBERWOOD BLVD,-79.6194986795774,43.7331917528331,2,13453439,,2018-09-05
4649,36474,GENTIAN DR AT RENFORTH DR,-79.585624112888,43.6648917369122,2,13464781,,2014-01-27
4650,36475,LYNWOOD AVE AT POPLAR PLAINS RD,-79.4034909015523,43.6851845114594,2,13460863,,2014-01-20
4651,36476,ARCHER RD AT BROWSIDE AVE,-79.415022421289,43.6962829845529,2,13458828,,2021-12-15
4652,36478,MEADOWVALE RD AT ROTARY DR,-79.1700010404837,43.8067870626009,2,13442623,,2024-01-24
4653,36479,HALFWAY AVE AT MORNINGSIDE AVE,-79.2137235180472,43.8179216518972,2,13442005,,2014-02-13
4654,36482,DUNLOE RD AT OLD FOREST HILL RD,-79.4145103404117,43.6978798450936,2,13458527,,2014-02-12
4655,36525,EMERSON AVE AT PATON ROAD,-79.441643947777,43.6610572624593,2,13465080,,2014-02-24
4656,36526,CORK AVE AT DUFFERIN ST,-79.454505549305,43.7130709871884,2,13456191,,2014-04-02
4657,36527,CHURCH ST AT LOMBARD ST,-79.3752036102057,43.6518064391044,2,13466415,,2014-03-26
4658,36532,BALMORAL AVE AT WARREN RD,-79.4055502660166,43.6837768789773,2,13461119,,2014-03-24
4659,36534,HARPER AVE AT ROSEDALE HEIGHTS DR,-79.3741569761739,43.6890165591166,2,13460065,,2014-04-23
4660,36535,LYNWOOD AVE AT WARREN RD,-79.4059099328111,43.684662706194,2,13460961,,2024-02-28
4661,36657,MARKHAM RD AT 260M SOUTH OF BRIMORTON DR (PX 2279),-79.22980000204464,43.771248001329816,2,30020519,2279,2014-03-03
4662,36658,PHARMACY AVE AT 115M NORTH OF RANNOCK ST (PX 2268),-79.29923500531544,43.729996996498635,2,30000992,2268,2018-02-27
4663,36661,WILSON AVE AT AGATE RD & MORTON SHULMAN AVE,-79.4854759227956,43.7258735697582,2,13454300,2285,2022-12-17
4664,36662,BRIMLEY RD AT 170M SOUTH OF HUNTINGWOOD DR (PX 2308),-79.27270899928665,43.79692900021384,1,30002252,2308,2016-12-15
4665,36663,BONIS AVE AT CARABOB CRT AND KING HENRY BLVD (PX 2338),-79.29716200338305,43.784113001146174,2,13445384,2338,2014-12-18
4666,36664,RANEE AVE AT VARNA DR (PX 2355),-79.44567400075948,43.72391500055903,2,13454478,2355,2023-05-09
4667,36665,FLEMINGTON RD AT RANEE AVE (PX 2356),-79.44865199637846,43.72328299551606,2,13454578,2356,2023-05-09
4668,36666,COLLEGE ST AT CONCORD AVE,-79.4239596637787,43.6541224617634,2,13466154,,2014-04-16
4669,36667,COLLEGE ST AT DELAWARE AVE,-79.4251621381526,43.6538658075447,2,13466197,,2014-04-22
4670,36694,BANK ST AT SHERIDAN AVE,-79.4326503436303,43.6473127932703,2,13467299,,2014-04-29
4671,36710,KIPLING AVE AT MARKBROOK LANE,-79.5893533284492,43.758460729522,2,13449457,,2019-12-19
4672,36711,WATERLOO AVE AT WILMINGTON AVE,-79.4543097201908,43.7565287554918,2,13449488,,2014-04-30
4673,36712,COMBE AVE AT WILMINGTON AVE,-79.4556165433374,43.7596460947943,2,13449046,,2019-12-17
4674,36713,BRIGHTON AVE AT WILMINGTON AVE,-79.4549559477422,43.7581059128386,2,13449262,,2014-04-28
4675,36715,INDIAN GRV AT RIDOUT ST,-79.4576526742592,43.6526975941476,2,13466452,,2018-09-20
4676,36716,SENLAC RD AT SHEPPARD AVE W,-79.4234082466756,43.7587439808256,2,13449099,,2021-12-02
4677,36730,GEORGE ST AT GERRARD ST E,-79.3748431721343,43.6606647246481,2,13465003,,2018-09-19
4678,36731,RATHBURN RD AT WEST DEANE PARK DR,-79.5576259387794,43.65651900026,2,13466070,,2018-01-23
4679,36778,ADELAIDE ST W AT STAFFORD ST,-79.4112256065153,43.6435860887374,2,13467778,,2017-02-16
4680,36800,COLLEGE ST AT SHAW ST (PX 2430),-79.42027299805792,43.6549099988766,2,13466032,2430,2021-09-15
