_id,location_id,location,lng,lat,centreline_type,centreline_id,px,latest_count_date
1432,5395,GUILDWOOD PKWY AT LIVINGSTON RD (PX 1058),-79.19924100108071,43.747506003922076,2,13450294,1058,2010-06-24
1433,5396,BATHURST ST AT FRONT ST W,-79.4014219974625,43.6407497966103,2,13468126,297,2022-02-23
1434,5397,BATHURST ST AT QUEEN ST W,-79.4040105032962,43.6471882946161,2,13467252,296,2022-07-02
1435,5398,BATHURST ST AT LENNOX ST (PX 1683),-79.4107160019523,43.663830001463765,2,13464590,1683,2014-06-03
1436,5399,BATHURST ST AT BLOOR ST W (PX 321),-79.41121200265817,43.66511499581122,2,13464373,321,2022-07-02
1437,5400,BATHURST ST AT WELLS ST (PX 1064),-79.41317899668013,43.67009699855207,2,13463530,1064,2014-05-27
1438,5401,BATHURST ST AT WILSON AVE (PX 320),-79.43400500463021,43.73735400234856,2,13452437,320,2022-12-17
1439,5402,HIGHWAY 401 N TCS AT MARKHAM RD (PX 971),-79.23600000250673,43.787081000439976,2,13444902,971,2014-03-29
1440,5403,GREENCEDAR CRCT AT GREENCREST CRCT & MARKHAM RD (PX 704),-79.22470900272555,43.757839996073564,2,13448822,704,2024-07-03
1441,5404,EASTPARK BLVD AT MARKHAM RD & STEVENWOOD RD (PX 1397),-79.22405599815895,43.75567900029876,2,13449130,1397,2014-04-08
1442,5405,MARKHAM RD AT PASSMORE AVE,-79.2507168200146,43.8305491592102,2,13441651,1732,2016-03-09
1443,5406,CONCORDE PL AT WYNFORD DR & WYNFORD HEIGHTS CRES,-79.3277366202216,43.7273581750244,2,13453804,1455,2022-04-06
1444,5407,BRUNSWICK AVE AT DUPONT ST,-79.4104842660369,43.6739546529439,2,13462884,,2018-06-28
1445,5408,KILBARRY RD AT ORIOLE PKWY,-79.4024035584621,43.6954945385725,2,13458957,1740,2016-04-13
1446,5409,CHAPLIN CRES AT ORIOLE PKWY (PX 115),-79.403320994897,43.69792699800818,2,13458486,115,2022-10-12
1447,5410,BEVERLEY ST AT COLLEGE ST & ST GEORGE ST (PX 827),-79.39590200379347,43.65870000038122,2,13465356,827,2021-08-12
1448,5411,COLLEGE ST AT MCCAUL ST (PX 825),-79.39348399398239,43.659199003895814,2,13465273,825,2017-01-17
1449,5412,AVENUE RD AT HIGHWAY 401 N TCS (PX 396),-79.42422099391975,43.743219996616766,2,13451491,396,2022-04-21
1450,5413,AVENUE RD AT CUMBERLAND ST,-79.3944800876542,43.669578695943,2,13463574,,2022-05-26
1451,5414,AVENUE RD AT COLLEGE VIEW AVE (PX 1497),-79.40744499846706,43.70183900251673,2,13457923,1497,2022-10-27
1452,5415,AVENUE RD AT CHAPLIN CRES (PX 116),-79.40615600522341,43.69877800179315,2,13458353,116,2022-10-12
1453,5416,AVENUE RD AT GLENCAIRN AVE,-79.4122996967229,43.7160054708112,2,13455613,,2022-12-14
1454,5417,AVENUE RD AT WOBURN AVE (PX 504),-79.41689300450741,43.72541999733111,2,13454239,504,2022-04-05
1455,5418,AVENUE RD AT MELROSE AVE (PX 1529),-79.41866499502096,43.72988600339747,2,13453553,1529,2022-04-07
1456,5419,AVENUE RD AT EGLINTON AVE W (PX 96),-79.40851599405057,43.70459800006033,2,13457449,96,2024-08-07
1457,5420,AVENUE RD AT BROOKE AVE (PX 121),-79.41949999666103,43.733244000253606,2,13453045,121,2022-04-07
1458,5421,ALBERT ST AT BAY ST (PX 65),-79.38264099929786,43.65297000072569,2,13466250,65,2019-02-02
1459,5422,BAY ST AT EDWARD ST,-79.3840034445879,43.65642557976,2,13465699,,2024-03-19
1460,5423,BAY ST AT CHARLES ST (PX 984),-79.38886899458909,43.66819600399932,2,13463813,984,2019-02-02
1461,5424,LAWRENCE AVE E AT WINSTON CHURCHILL CI & 144M E OF CANLISH R,-79.2797860483708,43.7485235009955,2,13450328,411,2008-10-20
1462,5425,BROCKLEY DR AT LAWRENCE AVE E,-79.2624597301909,43.7520655406472,2,13449737,1443,2023-09-19
1463,5426,BARRYMORE RD AT LAWRENCE AVE E,-79.251561113899,43.7542838484723,2,13449378,415,2012-02-02
1464,5427,BURNVIEW CRES AT LAWRENCE AVE E,-79.2401881819714,43.7566618892242,2,13449023,398,2020-03-11
1465,5428,LAWRENCE AVE W AT MARLEE AVE,-79.4465208238471,43.7156156249889,2,13455749,425,2022-11-15
1466,5429,BELLAMY RD N AT LAWRENCE AVE E (PX 416),-79.23526700556447,43.757721000090726,2,13448868,416,2022-04-05
1467,5430,FORTUNE GATE AT LAWRENCE AVE E (PX 1468),-79.21976799881057,43.76100600059315,2,13448378,1468,2011-03-08
1468,5431,GREENCREST CRCT AT GREENHOLM CRCT & LAWRENCE AVE (PX 1005),-79.2229820032572,43.76031200434479,2,13448487,1005,2024-07-03
1469,5432,LAWRENCE AVE E AT CURLEW DR & RAILSIDE RD E,-79.319279275565,43.7411825848658,2,13451566,406,2023-02-09
1470,5433,DON MILLS CENTRE AT LAWRENCE AVE E,-79.3450405526061,43.7368329127115,2,20234083,,1995-01-12
1471,5434,LAWRENCE AVE E AT THE DONWAY WEST (PX 401),-79.34654599399197,43.736507002179536,2,13452372,401,2023-02-28
1472,5435,CENTENNIAL RD AT LAWRENCE AVE (PX 1452),-79.14656300164087,43.77735799868698,2,13445921,1452,2014-02-25
1473,5436,LAWRENCE AVE E AT THE DONWAY EAST (PX 403),-79.34097699726928,43.73769500427209,2,13452186,403,2023-02-28
1474,5437,LAWRENCE AVE E AT WOODCLIFF PLACE,-79.3370825950227,43.7385086038599,2,13452045,,2024-02-29
1475,5438,LAWRENCE AVE AT RALPH ST  (PX 1779),-79.51212400255633,43.70109100016579,2,13458224,1779,2021-10-28
1476,5439,CULFORD RD AT LAWRENCE AVE W,-79.4876676307908,43.7063743854014,2,13457330,429,2020-03-10
1477,5440,LAWRENCE AVE AT SHERMOUNT AVE (PX 1004),-79.44133899830712,43.716693999091,2,13455564,1004,2018-12-04
1478,5441,CHATSWORTH DR AT LAWRENCE AVE (PX 501),-79.41134499841615,43.72318800297253,2,13454511,501,2018-04-11
1479,5442,MILITARY TR AT NEILSON RD (PX 1423),-79.20834300214646,43.78797200428679,2,13444720,1423,2022-02-24
1480,5443,NEILSON RD AT SEWELLS RD & TAPSCOTT RD (PX 1382),-79.21865399990571,43.806536000024025,2,13442715,1382,2022-02-26
1481,5444,BIRCH AVE AT YONGE ST,-79.3913402367922,43.6814318081777,2,13461519,,2022-03-29
1482,5445,BALMORAL AVE AT YONGE ST,-79.3931856766544,43.6858813548032,2,13460709,,2022-08-11
1483,5446,# 5775 YONGE ST AT YONGE ST,-79.4164534669269,43.783432738658,2,13445666,,2001-02-15
1484,5447,NEWTON DR AT PLEASANT AVE & YONGE ST,-79.4187942411545,43.7929562398991,2,13444488,,1995-11-13
1485,5448,DIXON RD AT CHETTA PL & WINCOTT DR (PX 985),-79.55215599930027,43.69579599885327,2,13459282,985,2023-11-22
1486,5450,DIXON RD AT GOLFWOOD HTS (PX 1354),-79.53988600551702,43.69856799753145,2,13458710,1354,2023-11-22
1487,5451,CARLTON ST AT CHURCH ST,-79.3793431639936,43.6618741406587,2,13464821,23,2023-06-21
1488,5452,CHURCH ST AT WELLESLEY ST E,-79.3809320003069,43.6657061284767,2,13464212,24,2022-07-02
1489,5453,MOUNT PLEASANT RD AT ST CLAIR AVE E,-79.3833282355347,43.690372035988,2,13459852,134,2022-10-12
1490,5454,MERTON ST AT MOUNT PLEASANT RD,-79.3864739095424,43.6981609781623,2,13458404,136,2023-02-16
1491,5455,MOUNT PLEASANT RD AT SHERWOOD AVE (PX 1626),-79.39266800091643,43.714980995657314,2,13455731,1626,2013-01-23
1492,5456,SHERBOURNE ST AT SHUTER ST (PX 319),-79.37012199393418,43.656161997879,2,13465715,319,2024-06-19
1493,5457,CARLTON ST AT SHERBOURNE ST (PX 260),-79.37306099903763,43.66319000331388,2,13464607,260,2024-06-19
1494,5458,SHERBOURNE ST AT WELLESLEY ST (PX 261),-79.37468299875049,43.66709399853632,2,13463953,261,2023-10-05
1495,5460,BIRKDALE RD AT ELLESMERE RD,-79.2664999323836,43.768941877299,2,13447325,1758,2022-12-17
1496,5461,CORPORATE DR AT RAMP HIGHWAY 401 E/B (PX 1502),-79.25339499756214,43.77924499582485,2,13445903,1502,2024-04-21
1497,5462,EVANS AVE AT THE WEST MALL (PX 735),-79.55866500208764,43.60835000248613,2,13470244,735,2016-11-26
1498,5463,THE WEST MALL AT WEST MALL CRES (PX 1340),-79.55889899694829,43.62716099832156,2,13469504,1340,2024-06-12
1499,5464,WENDELL AVE AT WILSON AVE (PX 1130),-79.5270790059964,43.71679699970267,2,13455730,1130,2022-12-17
1500,5465,PLEASANT HOME BLVD AT WILSON AVE,-79.4837018987834,43.7262809067927,2,13454244,,2013-04-08
1501,5466,WILSON AVE AT BELGRAVE AVE & TORONTO CRICKET CLUB,-79.4182021291257,43.7406294112718,2,13451886,1622,2022-12-17
1502,5467,BAYVIEW AVE AT HIGHWAY 401 N TCS (PX 647),-79.38748999761486,43.76451500038706,2,13448236,647,2019-06-13
1503,5468,BAYVIEW AVE AT HIGHWAY 401 S TCS (PX 646),-79.38684399948286,43.761842001678616,2,13448602,646,2019-06-13
1504,5469,BAYVIEW AVE AT MCRAE DR & MERTON ST (PX 170),-79.37337500211969,43.700941000302464,2,13457987,170,2019-03-20
1505,5470,BAYVIEW AVE AT SUNNYDENE CR,-79.3787159301482,43.7197200295613,2,13454957,,2008-07-14
1506,5471,# 2130 BAYVIEW AT VAUGHAN EST & 70M S OF VALLEYANNA DR (PX 1650),-79.3794909985781,43.72370799697242,2,20235610,1650,2020-10-27
1507,5472,# 2395 BAYVIEW AVE AT GRANITE CLUB & BOB RUMBLE CENTRE (PX 189),-79.38141900267023,43.7340759991418,1,443573,1766,2011-05-10
1508,5473,BAYVIEW AVE AT POTTERY RD (PX 1379),-79.36358417089976,43.68791678542844,2,13460241,1379,2024-06-18
1509,5474,BAYVIEW AVE AT FIFE RD & FIFESHIRE S RD (PX 645),-79.38552899510316,43.75481899906069,2,13449593,645,2018-10-23
1510,5475,BAYVIEW AVE AT CITATION DR & EMPRESS AVE (PX 649),-79.3897830019111,43.77433300400928,2,13446795,649,2017-06-19
1511,5476,BAYVIEW AVE AT GARNIER CRT & NEWTON DR (PX 872),-79.39517799529705,43.79915300294599,2,13443696,872,2018-01-30
1512,5477,BROWNS LINE AT EVANS AVE & HIGHWAY 427 W TCS (PX 866),-79.54914200074731,43.61061400350075,2,13470179,866,2021-12-14
1513,5478,CORONATION DR AT MORNINGSIDE AVE (PX 1184),-79.18360999379011,43.76191200176843,2,13448171,1184,2023-12-10
1514,5480,EVANS AVE AT THE EAST MALL (PX 892),-79.54380600592128,43.61182899741318,2,13470147,892,2024-03-26
1515,5481,NORTH QUEEN ST AT THE EAST MALL (PX 1056),-79.54941500033704,43.62047500029841,2,13469836,1056,2021-12-11
1516,5482,EAST MALL CRES AT THE EAST MALL (PX 904),-79.55233800044799,43.63143500097686,2,13469262,904,2023-01-18
1517,5483,BROADVIEW AVE AT MORTIMER AVE & POTTERY RD (PX 440),-79.35694899468722,43.68393099830746,2,13460964,440,2022-02-16
1518,5484,BROADVIEW AVE AT COSBURN AVE,-79.3552662205806,43.6885471877001,2,13460112,441,2023-07-25
1519,5485,MARTIN GROVE RD AT PORTERFIELD RD (PX 1886),-79.58501100478132,43.722176996827116,2,13454996,1886,2023-11-29
1520,5486,EASTERN AVE AT LOGAN AVE (PX 818),-79.34139700268494,43.657878000621814,2,13465362,818,2022-02-24
1521,5487,ESANDAR DR AT LAIRD DR (PX 2324),-79.36148200526091,43.70527099806106,2,13457222,2324,2013-05-02
1522,5488,GERRARD ST E AT PAPE AVE (PX 371),-79.34040000297655,43.66817300237045,2,13463705,371,2021-10-27
1523,5489,JONES AVE AT QUEEN ST E (PX 546),-79.33281399496882,43.662671002421476,2,13464597,546,2022-06-25
1524,5490,GERRARD ST E AT JONES AVE (PX 370),-79.33560800374983,43.66924999864902,2,13463478,370,2022-06-25
1525,5491,SHEPPARD AVE E AT FAIRVIEW MALL DR (PX 746),-79.34116899631732,43.77621399697339,2,13446468,746,2023-02-28
1526,5492,SHEPPARD AVE E AT HWY 404 N & YORKLAND RD (PX 747),-79.3377519995262,43.77583200375355,2,13446509,747,2023-02-28
1527,5493,MIDLAND AVE AT SHEPPARD AVE E,-79.2785700882727,43.7853480511347,2,13445219,862,2021-08-28
1528,5495,DORIS AVE AT SHEPPARD AVE E,-79.4082643038483,43.7621017936671,2,13448605,1200,2023-02-08
1529,5496,BESSARION RD AT BURBANK DR & SHEPPARD AVE (PX 743),-79.37664800230009,43.769198998155744,2,13447531,743,2019-11-26
1530,5497,BUCHAN CT AT SHEPPARD AVE (PX 1517),-79.35866499450745,43.77257200349963,2,13446985,1517,2014-03-19
1531,5498,HAWKSBURY DR AT REAN DR & SHEPPARD AVE (PX 742),-79.38313899862331,43.76780300424217,2,13447758,742,2019-05-09
1532,5499,BRYANT ST AT SHEPPARD AVE & YEOMANS RD (PX 2243),-79.44346500195338,43.75450100431714,2,13449763,2243,2019-12-17
1533,5500,BEECROFT RD AT SHEPPARD AVE (PX 1169),-79.41315999825879,43.76102699714343,2,13448755,1169,2023-11-23
1534,5501,KIPLING AVE AT LAKE SHORE BLVD (PX 237),-79.51694999863516,43.5981979995018,2,13470536,237,2022-02-08
1535,5502,EVANS AVE AT KIPLING AVE (PX 765),-79.52462800222237,43.615872999051234,2,13470006,765,2022-02-12
1536,5503,KIPLING AVE AT NORTH QUEEN ST (PX 724),-79.52855199773519,43.62520699698455,2,13469594,724,2022-02-08
1537,5504,DIXON RD AT KIPLING AVE (PX 435),-79.55864900592441,43.69424900448849,2,13459576,435,2022-02-12
1538,5505,KIPLING AVE AT SNARESBROOK DR (PX 2139),-79.57151100476827,43.721701000722874,2,13455043,2139,2022-02-08
1539,5506,FINCH AVE W AT KIPLING AVE (PX 1570),-79.58211599589914,43.74326300201363,2,13451819,1570,2022-02-12
1540,5507,KIPLING AVE AT STEELES AVE W,-79.5898847678205,43.7595972080092,2,13449294,1256,2022-12-10
1541,5508,EASTERN AVE AT LESLIE ST (PX 302),-79.32947600296454,43.661544999783345,2,13464758,302,2022-02-26
1542,5509,KIRKWOOD RD AT LESLIE ST,-79.3607686967835,43.7564358484064,2,13449313,,2010-02-02
1543,5510,BALLYRONAN RD AT LESLIE ST & LONGWOOD DR,-79.3592342920383,43.7494996711464,2,13450365,,2015-06-23
1544,5511,LESLIE ST AT CUMMER AVE & MCNICOLL AVE,-79.3707219179402,43.8013034919845,2,13443403,952,2023-06-18
1545,5512,ELLESMERE RD AT MEADOWVALE RD,-79.1635657067808,43.7924871522047,2,13444084,1687,2022-12-17
1546,5513,FAIRVIEW MALL DR AT HIGHWAY 404 & DVP S/B RAMP (PX 1515),-79.34159799568661,43.778708003352214,2,13446145,1515,2023-02-28
1547,5514,FAIRVIEW MALL DR AT FAIRVIEW MALL DR EXT & SUNLIFE BLDG (PX 1514),-79.34264599844373,43.77972800381656,2,13446011,1514,2010-06-07
1548,5515,AU LARGE BLVD AT DON MILLS RD,-79.3551972873206,43.7964391033146,2,13443957,1782,2023-02-28
1549,5516,DON MILLS RD AT GATEWAY BLVD S & OVERLEA BLVD,-79.3343949847785,43.7099964553998,2,13456414,620,2023-01-14
1550,5517,DON MILLS RD AT MOATFIELD DR,-79.3471541713182,43.7586212513862,2,13448975,1353,2023-03-21
1551,5518,DON MILLS RD AT CLOCK TOWER RD - SHOPS AT DON MILLS (PX 1643),-79.34271200190064,43.73443300296281,2,20234111,1643,2009-11-23
1552,5519,DON MILLS RD AT THE DONWAY S,-79.3421156171595,43.7322442881024,2,13453034,625,2023-02-28
1553,5520,DON MILLS RD AT THE DONWAY N,-79.3444575331059,43.7408435594891,2,13451688,624,2023-04-29
1554,5521,EASTERN AVE AT KNOX AVE (PX 1265),-79.32527000348757,43.662515995795346,2,13464606,1265,2022-02-24
1555,5522,GREENWOOD AVE AT QUEEN ST E (PX 1393),-79.32530799546537,43.664397000581396,2,13464286,1393,2022-06-25
1556,5523,COSBURN AVE AT GREENWOOD AVE (PX 667),-79.33776300423641,43.69202799839932,2,13459436,667,2019-08-12
1557,5524,COXWELL AVE AT SAMMON AVE (PX 657),-79.32585799824857,43.68878099670969,2,13459980,657,2023-11-15
1558,5525,ELMHURST DR AT ISLINGTON AVE (PX 716),-79.5589219980545,43.723111999975615,2,13454806,716,2023-12-05
1559,5526,BIRMINGHAM ST AT ISLINGTON AVE (PX 1312),-79.50630800210386,43.60326700061573,2,13470367,1312,2021-03-24
1560,5527,EVANS AVE AT ISLINGTON AVE (PX 775),-79.51132799447984,43.618393002076374,2,13469914,775,2021-12-01
1561,5528,ISLINGTON AVE AT JUTLAND RD (PX 908),-79.51698599799985,43.628943998662905,2,13469379,908,2024-02-21
1562,5529,ISLINGTON AVE AT TITAN RD (PX 1885),-79.5177620053191,43.63087600287034,2,13469267,1885,2014-05-03
1563,5530,ISLINGTON AVE AT RATHBURN RD (PX 707),-79.53118900405936,43.662411002249485,2,13465055,707,2014-04-28
1564,5531,EGLINTON AVE W AT ISLINGTON AVE,-79.5390146385861,43.6798351890888,2,13462163,709,2024-05-29
1565,5532,ALLENBY AVE AT HIGHWAY 401 N TCS & ISLINGTON AVE (PX 713),-79.55335700374687,43.71140999575211,2,13456687,713,2024-05-29
1566,5533,BERGAMOT AVE AT ISLINGTON AVE (PX 715),-79.55598300173916,43.71694699918932,2,13455765,715,2014-04-26
1567,5534,FINCH AVE E AT SKYMARK DR,-79.3522895338089,43.7931617517311,2,13444344,1454,2023-03-25
1568,5535,FINCH AVE E AT PHARMACY AVE,-79.3259693634014,43.7943314328049,2,13444158,1092,2024-06-11
1569,5536,# 3521 FINCH AVE AT ST AIDENS SCHOOL,-79.2956676225937,43.7922114201334,2,13444365,,1995-11-07
1570,5537,FINCH AVE E AT ADIRONDACK GT & WAYSIDE AVE,-79.2996483193579,43.8005175166644,2,13443377,1598,2024-06-11
1571,5538,FINCH AVE E AT MILLIKEN BLVD,-79.2942961764446,43.8018132164684,2,13443239,1566,2024-06-11
1572,5539,FINCH AVE E AT 4150 FINCH AVE E,-79.2916056984135,43.8024654510478,2,13443173,,1995-06-12
1573,5540,FINCH AVE E AT TAPSCOTT RD,-79.237137059989,43.8142178022924,2,13442174,1258,2022-02-22
1574,5541,FINCH AVE AT NEILSON RD (PX 1587),-79.22760000117592,43.81626500112772,2,13442074,1587,2024-06-19
1575,5542,OLD FINCH AVE AT ROUGE RIVER BRIDGE (PX 2519),-79.19660899714926,43.825314998177745,1,30019596,2519,2018-08-28
1576,5543,FINCH AVE E AT BRAHMS AVE & LINUS RD,-79.3580748102644,43.7919621649671,2,13444508,1059,2023-02-28
1577,5544,BRIDLETOWNE CIR W AT FINCH AVE E,-79.3193128422642,43.7958514663466,2,13443970,1186,2024-06-11
1578,5545,FINCH AVE E AT GORDON BAKER RD & HIGHWAY 404 E TCS,-79.3412619102134,43.7951475593404,2,13444088,1181,2024-06-11
1579,5546,FAIRVIEW MALL DR AT GODSTONE RD (PX 1228),-79.34573500562284,43.77963400325862,2,13446033,1228,2024-04-04
1580,5547,FINCH AVE AT HIGHWAY 27 (PX 1163),-79.60308699604157,43.7341690007891,2,13453246,1163,2022-02-12
1581,5548,ARDWICK W BLVD AT FINCH AVE & PEARLDALE AVE (PX 1223),-79.5623589980437,43.747765004278094,2,13451044,1223,2010-11-29
1582,5549,ARROW RD & SIGNET DR AT FINCH AVE W (PX 810),-79.53626299973963,43.75329000347145,2,13450142,810,2022-02-12
1583,5550,ELANA DR AT FINCH AVE & YORK GATE BLVD (PX 1590),-79.52070199806234,43.75673199596357,2,13449584,1590,2016-10-18
1584,5551,FINCH AVE AT TOBERMORY DR (PX 1002),-79.50792999851964,43.759283003050186,2,13449201,1002,2013-02-14
1585,5552,ALEXDON RD AT FINCH AVE,-79.4855194438842,43.7646930630836,2,13448395,,2016-07-06
1586,5553,FINCH AVE AT TANGIERS RD (PX 1616),-79.48827799878059,43.76408699671999,2,13448492,1616,2016-02-23
1587,5554,CHESSWOOD DR AT FINCH AVE (PX 1253),-79.47753299942802,43.766490999926106,2,13448130,1253,2023-11-18
1588,5555,FINCH AVE W AT GRANTBROOK ST,-79.4317223948465,43.7761888481295,2,13446625,,2023-11-02
1589,5556,FINCH AVE AT WESTMORE DR (PX 1459),-79.60100099866979,43.73463199599435,2,13453185,1459,2009-12-02
1590,5557,EVANS AVE AT ROYAL YORK RD,-79.5003969301289,43.6210122527702,2,13469783,1334,2022-12-13
1591,5558,LA ROSE AVE AT ROYAL YORK RD (PX 1439),-79.52741300575066,43.68415399569801,2,13461359,1439,2022-12-10
1592,5559,PARK LAWN RD AT PARK LAWN GARDINER W RAMP (PX 1055),-79.4877539985203,43.62710499825238,2,13469460,1055,2022-03-30
1593,5560,LUMSDEN AVE AT MAIN ST (PX 656),-79.30476899477168,43.69483300401187,2,13458804,656,2022-02-16
1594,5561,DAWES RD AT PARK VISTA,-79.297071755495,43.6982465588564,2,13458204,,2016-02-23
1595,5562,CHAPMAN RD AT SCARLETT RD,-79.514284462809,43.6889895864095,2,13460428,,2023-03-28
1596,5563,HIGHWAY 404 S AT STEELES AVE E,-79.3551189612586,43.8124839711865,2,14228218,1261,2023-01-31
1597,5564,STEELES AVE E AT ASHCOTT ST & FENTON RD,-79.2917431545967,43.8272415768292,2,13441706,1578,2022-12-10
1598,5565,STEELES AVE E AT HILLCROFT DR & STRAWBERRY HILLS DR,-79.2804015289569,43.8298427386339,2,13441658,1547,2022-12-10
1599,5566,STEELES AVE E AT ESNA PARK DR & PHARMACY AVE,-79.3364653609247,43.8168587559035,2,13442123,1190,2023-01-31
1600,5567,STEELES AVE E AT FIREBRACE RD & IBM ACCESS RD,-79.3320996208507,43.8178819078953,2,13442071,1618,2023-01-31
1601,5568,BIRCHMOUNT RD AT STEELES AVE E,-79.3169115120963,43.8214068251895,2,13441903,1363,2023-01-31
1602,5569,BESTVIEW DR AT STEELES AVE E,-79.3834013988996,43.8061040964773,2,13442971,,2017-05-10
1603,5570,STEELES AVE E AT KELVIN GROVE AVE & PUTNAM GATE,-79.3122221692792,43.8224978354364,2,13441856,1503,2023-01-31
1604,5571,EDGAR WOODS RD AT STEELES AVE E,-79.3627875113135,43.8107280843709,2,13442557,,2022-03-29
1605,5572,STEELES AVE E AT TOWNSEND RD,-79.3575556725031,43.8119179303512,2,13442457,1185,2023-01-31
1606,5573,STEELES AVE E AT WOODBINE AVE,-79.3485557932883,43.8139697808004,2,13442279,1262,2023-01-31
1607,5574,ASPENWOOD DR AT STEELES AVE E,-79.3677529070111,43.8095933174725,2,13442637,,2024-07-23
1608,5575,GAUDAUR RD AT STEELES AVE W,-79.5605577596413,43.767410317351,2,14228141,,1995-02-21
1609,5576,FUTURITY GT AT GERRY FITZGERALD DR & STEELES AVE (PX 1764),-79.47475699424095,43.786183001041934,2,14673438,1764,2015-05-13
1610,5577,STEELES AVE W AT BLACK HAWKWAY & NEW WESTMINSTER DR,-79.457587473909,43.7898646977139,2,13444956,1414,2022-12-10
1611,5578,STEELES AVE W AT CONLEY ST & HIDDEN TRL,-79.4631955129541,43.7886739089242,2,13445128,1230,2022-12-10
1612,5579,STEELES AVE W AT PETROLIA RD & TANDEM RD,-79.4901029644657,43.782572136733,2,13445906,1383,2022-12-10
1613,5580,STEELES AVE W AT THURMAN RD & TORRESDALE AVE,-79.4530298330688,43.7908649764531,2,13444817,1229,2022-12-10
1614,5581,STEELES AVE E AT WILLOWDALE AVE,-79.414460444548,43.7992627629681,2,13443721,986,2023-01-31
1615,5582,STEELES AVE W AT BARMAC DR & SCHOLES RD,-79.5549881135823,43.7685669032639,2,13448007,1542,2022-12-10
1616,5583,DON RDWY AT LAKE SHORE BLVD (PX 208),-79.34696199456818,43.650893001846285,2,13466497,208,2021-04-08
1617,5584,LAKE SHORE BLVD AT LOGAN AVE,-79.3396684778161,43.6540134517618,2,13466003,,2021-03-24
1618,5585,COLBORNE LODGE DR AT LAKE SHORE BLVD (PX 1456),-79.45896599976801,43.637969996862324,2,13468529,1456,2014-12-03
1619,5586,BLANTYRE AVE AT KINGSTON RD,-79.2813476854686,43.6814624244391,2,13461219,,2022-06-15
1620,5587,COURCELETTE RD AT KINGSTON RD,-79.2802945421658,43.68185585062,2,13461133,,2006-05-08
1621,5588,FALLINGBROOK RD AT KINGSTON RD,-79.2792416156221,43.6822574406743,2,13461056,157,2015-11-11
1622,5589,DIXON AVE AT DUNDAS ST E & KINGSTON RD,-79.3111821687613,43.6699741706634,2,13463293,163,2022-04-20
1623,5590,EGLINTON AVE E AT KINGSTON RD,-79.2116632667346,43.743722153208,2,13450880,147,2022-06-15
1624,5591,CROMWELL RD AT GUILDWOOD PKWY & KINGSTON RD,-79.2059570858171,43.7496569165854,2,13449983,146,2024-06-19
1625,5592,KINGSTON RD AT OVERTURE RD & PAYZAC AVE,-79.1975801228406,43.7589703025506,2,13448608,2191,2009-09-09
1626,5593,ELLESMERE RD AT KINGSTON RD,-79.1545965299292,43.7935798323196,2,13443928,1670,2022-12-17
1627,5594,ELMER AVE AT KINGSTON RD (PX 1971),-79.30590300611397,43.67569999982555,2,13462329,1971,2015-11-11
1628,5595,TORYORK DR AT WESTON RD,-79.5427093961598,43.7533361398973,2,13450145,393,2009-06-08
1629,5596,MCCORMACK ST AT WESTON RD (PX 721),-79.47190599937134,43.677228003838984,2,13462466,721,2015-04-22
1630,5597,WESTON RD AT ELSMERE AVE & LITTLE AVE,-79.5194047942055,43.7010387697586,2,13458241,582,2023-01-24
1631,5599,QUEENS PLATE DR E AT REXDALE BLVD,-79.5926152652059,43.716531462092,2,13455913,1668,2022-12-17
1632,5600,DANFORTH RD AT GORDONRIDGE PL & WOLFE AVE (PX 988),-79.25263000503567,43.727388998809204,2,13453572,988,2020-10-01
1633,5601,DANFORTH RD AT EGLINTON AVE E,-79.2461640653853,43.7370972916531,2,13452053,379,2024-06-19
1634,5602,MEDONTE AVE AT TIAGO AVE& VICTORIA PARK AVE,-79.2977082737701,43.7129590139749,2,13455841,,2006-04-25
1635,5603,ASHTONBEE RD AT PHARMACY AVE (PX 1295),-79.29861500136046,43.72852299787959,2,13453497,1295,2013-03-12
1636,5604,ELM BANK RD AT PHARMACY AVE,-79.3010450727476,43.7344599105851,2,13452605,,1994-03-23
1637,5605,DANFORTH RD AT WARDEN AVE (PX 418),-79.27483499755657,43.69717699957756,2,13458308,418,2022-02-15
1638,5606,SHERWOOD AVE AT WARDEN AVE (PX 1657),-79.29348000369602,43.74224099935118,2,13451351,1657,2022-02-16
1639,5607,JEFFERSON AVE AT KING ST W,-79.4222813304384,43.6399770993151,2,13468250,,2017-11-28
1640,5608,THE EAST MALL AT THE QUEENSWAY (PX 911),-79.54628700423605,43.61641900429032,2,13469998,911,2023-04-01
1641,5609,WESTON RD AT KING ST & KING STREET CRES,-79.5206781997309,43.7013707387644,2,13458203,1694,2023-01-24
1642,5610,JANE ST AT WESTON RD (PX 528),-79.50089099975959,43.691301000753214,2,13459968,528,2024-06-04
1643,5611,JANE ST AT 35M N OF MACDONALD AVE & MARSHLYNN AVE (PX 1675),-79.50427000036642,43.70471999665537,1,11752588,1675,2013-11-25
1644,5612,CHURCH ST AT JANE ST & MAPLE LEAF DR (PX 530),-79.5055659982582,43.709244997259916,2,13456926,530,2021-08-28
1645,5613,HULLMAR DR AT JANE ST (PX 2401),-79.52142699488321,43.77320700136196,2,13447218,2401,2018-04-04
1646,5614,ANNETTE ST AT DUNDAS ST W & DUPONT ST & OLD WESTON RD,-79.4587775868743,43.6644860359374,2,13464592,1549,2022-12-17
1647,5616,DUNDAS ST W AT SHAW ST,-79.4182883979142,43.6498253417836,2,13466833,1275,2022-03-02
1648,5617,DUNDAS ST W AT PALMERSTON AVE,-79.4084741173994,43.6517995277572,2,13466492,2602,2024-07-23
1649,5619,# 720 KENNEDY RD AT KENNEDY RD (PLAZA),-79.2660113803524,43.7276161115932,2,13453566,,2001-12-12
1650,5620,KENNEDY RD AT TROJAN GT (PX 1671),-79.29820800479771,43.80388099610779,2,13443052,1671,2018-12-18
1651,5621,KENNEDY RD AT ST CLAIR AVE (PX 475),-79.26133399831951,43.71652499983062,2,13455179,475,2024-06-18
1652,5622,ALBION RD AT SHENDALE DR (PX 2064),-79.54754199863577,43.7225499961763,2,13454866,2064,2016-05-25
1653,5623,BONIS AVE AT CARDWELL AVE & KENNEDY RD (PX 1576),-79.28946199490564,43.78576100297176,2,13445197,1576,2018-12-19
1654,5624,KENNEDY RD AT PASSMORE AVE & PURCELL BLVD (PX 1396),-79.3047529960951,43.81844699814371,2,13442033,1396,2015-05-23
1655,5625,MORNINGSIDE AVE AT SOUTH KINGSWAY,-79.4819140327174,43.6440862988228,2,13467842,2334,2024-04-30
1656,5626,STEELES AVE W AT CAPSTAN GT & SHALE GT,-79.4872700773301,43.7832399218016,2,13445817,1672,2022-12-10
1657,5627,GERRARD ST AT MARJORY AVE (PX 1698),-79.33758300447376,43.66879600433488,2,13463573,1698,2017-05-15
1658,5628,BLOOR ST AT PARK RD,-79.3842095596079,43.6708044294258,2,13463329,,2017-04-11
1659,5630,BLOOR ST AT MANNING AVE (PX 1269),-79.41599100583558,43.66408799958192,2,13464559,1269,2023-11-14
1660,5631,BLOOR ST W AT MARKLAND DR W,-79.5798277475507,43.6292910911,2,13469403,1114,2018-12-19
1661,5632,BLOOR ST W AT MARKLAND DR E,-79.570784243055,43.6335561915137,2,13469133,1016,2018-12-18
1662,5633,BLOOR ST AT THE WEST MALL (PX 793),-79.56231799595565,43.635625002979666,2,13468898,793,2024-02-21
1663,5634,BLOOR ST W AT GREEN LANES,-79.5256340026359,43.6441886772779,2,13467896,1676,2024-05-08
1664,5635,BYNG AVE AT DANFORTH AVE (PX 1664),-79.28005199721392,43.6930559982485,2,13459073,1664,2022-06-01
1665,5636,CHESTER AVE AT DANFORTH AVE (PX 342),-79.35196499847086,43.677555999312354,2,13462109,342,2022-03-08
1666,5637,DANFORTH AVE AT JONES AVE,-79.3401779386932,43.6798746270727,2,13461657,346,2023-04-20
1667,5638,DANFORTH AVE AT DONLANDS AVE (PX 347),-79.33731500466094,43.68042100068259,2,13461561,347,2022-03-08
